bgg_id,primary_name,all_names,year,description,min_players,max_players,playing_time,min_play_time,max_play_time,min_age,categories,mechanics,families,designers,artists,publishers,bgg_rank,average_rating,bayes_average,users_rated,weight,owned
100278,Tripolo,Tripolo; 셋셋셋,2011,"3 in a row makes TRIPOLO.&#10;&#10;Wherever you spot 2 similar cards in a row, play a matching card from your hand to make it a &quot;TRIPOLO&quot; &mdash; 3 in a row horizontally, vertically, or diagonally. Act fast to be the first player to get rid of all your cards.&#10;&#10;Make matches as fast as you can!&#10;&#10;",2,4,0,0,0,6,Animals; Children's Game; Educational,Pattern Recognition,,Maureen Hiron,Fian Arroyo,Game Factory; Happy Baobab; Kanga Games; Lúdilo; Stragoo Games; USA Games Inc; Vennerød Forlag AS,19084,6.27419,5.51733,62,1,150
101239,Ponder,Ponder; Kernouille,2010,"Welcome to the Pond! You are just in time for the annual frog race. The distance is &quot;one English pond&quot;, and your goal in Ponder is to get your team to the other side of the pond before everyone else.&#10;&#10;Your frogs can't jump clear from one side of the pond to the other, however, so you'll need to lay down lily pads so that they can cross the water. Since the pond is so crowded with frogs, you can move only as the cards tell you to. In game terms, each turn you can take one of thr...",2,4,45,45,45,7,Animals; Children's Game; Racing,Hand Management,Animals: Frogs / Toads,Isabel Holmberg,,Carrom Art; Mindtwister AB; Mindtwister USA; Piatnik,23953,5.52394,5.50055,71,1,146
10372,Diamant,Diamant,1975,"The mystic board is in itself enticing. Almost hand-wide in height with ponderous bulges, in magical midnight- blue with glittering diamonds. The game is to light up the individual diamonds with invisible beam. This is done by clever placing of the silver colored stones on the board thus directing the invisible beam onto the right diamonds.&#10;&#10;",2,4,30,30,30,8,Abstract Strategy,Area Movement,Components: 4 x 4 Grids; Series: Buchkassette (Pelikan),Andrea Steyn,,Pelikan,21554,6.15484,5.50915,31,1.5,127
104006,Village,Village; Descendance; Het Dorp; Kronika panství; Pokolenia; La Villa; Village: Cronica generațiilor; Village: La Vita è un Gioco; Village: Nemzedékek játéka; Village: Ο Κύκλος της Ζωής; Летопись; Селище; 村の人生; 村莊,2011,"Life in the village is hard &ndash; but life here also allows the inhabitants to grow and prosper as they please. One villager might want to become a friar. Another might feel ambitious and strive for a career in public office. A third one might want to seek his luck in distant lands.&#10;&#10;Each player will take the reins of a family and have them find fame and glory in many different ways. There is one thing you must not forget, however: Time will not stop for anyone and with time people wil...",2,4,90,60,90,12,Economic; Farming; Medieval,"Area Majority / Influence; Contracts; Set Collection; Turn Order: Claim Action; Worker Placement; Worker Placement, Different Worker Types",Digital Implementations: Tabletopia; Game: Village,Inka Brand; Markus Brand,Dennis Lohausen,"eggertspiele; 999 Games; Albi; Delta Vision Publishing; Fantasmagoria; Fire on Board Jogos; Gigamic; hobbity.eu; Hobby Japan; KADABRA; Kaissa Chess & Games; Lautapelit.fi; Ludicus Games; Ludonova; Pegasus Spiele; Plan B Games; Stronghold Games; Swan Panasia Co., Ltd.; Tasty Minstrel Games; uplay.it edizioni; Zvezda",238,7.48682,7.28945,24011,3.0612,30834
10582,Who Wants to Be a Millionaire Junior,Who Wants to Be a Millionaire Junior; Haluatko miljonääriksi? Junior; Hvem vil være millionær? Junior; Legyen Ön is milliomos Junior; Vil du Bli millionær junior; Viltu vinna milljón? Barna- og unglingaspilið; Weekend Miljonairs Junior; Wer wird Millionär Junior,2000,This game is exactly like &quot;Who Wants To Be A Millionaire&quot; in every way except the questions are easier and geared to a younger audience.&#10;&#10;Great for the kids and those who aren't good at trivia.&#10;&#10;,2,5,45,45,45,8,Children's Game; Movies / TV / Radio theme; Trivia,Push Your Luck,TV Shows: TV Game Shows; TV Shows: Who Wants To Be A Millionaire,(Uncredited),,Celador; danspil; Jumbo; Piatnik; Pressman Toy Corp.,26778,4.73469,5.48351,49,1,140
107007,Pohjanmaan Valtias,Pohjanmaan Valtias,2011,"Pohjanmaan Valtias is an adventure and conquering game, where every player can choose are they good guy or bad guy. &#10;The main goal of the game is to conquer the area of Pohjanmaa.&#10;&#10;Game features:&#10;&#10;-Freeflow moving around the game world by cards.&#10;-Buy cities and villages.&#10;-Conquer cities of other players by knife fight.&#10;-Complete missions as a good guy or bad guy to earn money.&#10;-Punish other players by sending them behind sauna or destroy their cities.&#10;-Tak...",2,6,90,90,90,10,Adventure; Fighting; Humor; Territory Building,Area Majority / Influence; Area Movement; Auction / Bidding; Open Drafting; Point to Point Movement; Rock-Paper-Scissors,,,,Jukolautapelit,,5.72692,0,26,3,33
107448,Sagrada,Sagrada,2007,"Sagrada is a Spanish learning game with German as the source language.&#10;&#10;Summary&#10;&#10;The players of Sagrada focus on two goals: First, they want to learn or revise the core vocabulary of Spanish nouns (about 800 words). Second, the players want to complete the unfinished church La Sagrada Familia. Towards this end, each player gets a number of jigsaw puzzle pieces which they have to buy during the game. The required money is earned by trading in language cards and asset cards. The ga...",2,4,60,60,60,0,Educational,Roll / Spin and Move,,Ulrich Paulus,Hardy Kaiser,Parland Spiele,,6.695,0,10,0,59
10750,Imperium,Imperium,1997,"A Swedish strategy game in which players represent major European powers in a pseudo-WWII scenario.  The theater of war is Europe and North Africa, and the units are all land-based - Infantry and Armour.&#10;&#10;Air and Naval units are provided for with the use of cards, which also allow the use of special strategy and tactics (paratroopers, anti-aircraft fire, fortifications, amphibious invasion), and politics (industrial reserves, propaganda).&#10;&#10;",2,4,180,180,180,12,Industry / Manufacturing; Political; World War II,Area Movement,,(Uncredited),,Ruphus & Ramses,,7,0,7,0,35
107529,Kingdom Builder,Kingdom Builder; Królestwo w Budowie; Строители королевств,2011,"In Kingdom Builder, the players create their own kingdoms by skillfully building their settlements, aiming to earn the most gold at the end of the game.&#10;&#10;Nine different kinds of terrain are on the variable game board, including locations and castles. During his turn, a player plays his terrain card and builds three settlements on three hexes of this kind. If possible, a new settlement must be built next to one of that player&rsquo;s existing settlements. When building next to a location,...",2,4,45,45,45,8,Medieval; Territory Building,Area Majority / Influence; Chaining; Enclosure; Grid Movement; Hexagon Grid; Modular Board; Network and Route Building; Pattern Building; Tile Placement; Variable Set-up,Components: Map (Regional scale); Components: Wooden pieces & boards; Digital Implementations: Board Game Arena; Digital Implementations: BrettspielWelt; Game: Kingdom Builder; Misc: LongPack Games; Series: Yellow Wave Box (Queen),Donald X. Vaccarino,Oliver Schlemmer,Queen Games; Devir; Enigma (Bergsala Enigma); Evrikus; Lautapelit.fi; Rebel Sp. z o.o.,744,6.93888,6.78967,24328,2.0678,30772
11028,Lotto,"Lotto; Alphabet Lotto; Anche Loro!!; Animal Lotto; Astrid Lindgrens Lotto; Auto Lotto; Auto-Lotto; Babar Lotto; Bambino Lotto; Bamse Lotto; Bank; Banko; Bauernhof-Lotto; Beano; Ben & Holly's Little Kingdom Lotto Game; Benjamin Blümchen Lotto; Benjamin Blümchen Zirkus Lotto; Benjamin Blümchen Zoo Lotto; Bilder + Leselotto; Bilder ABC; Bilder-Lotto; Bilder-Lotto: Im Wald und auf der Heide; Bilderlegespiel; Bilderlotto; Bilderlotto für unsere Kleinsten; Billedelotteri; Billedlotteri; Blumen-Lotto; Blumenlotto; Bozo TV Lotto; Bussi Bär: Verkehrszeichen Lotto; Casper's Picture Lotto; Children of Foreign Lands Lotto; City Lotto; Classic Bingo; Danmark i Billedelotteri; Dick Bruna Lotto; Dino-Lotto; Dinosaurier Lotto; Disney Lotto; Dyre-Lotto; Das ein mal eins als Lotterie; Ein-Mal-Eins-Lotto; Einst und Jetzt Lotto; Erstes Lotto; Fabeltjeskrant Lotto; Fairy-Tale Lotto; Familiar Objects; Farbiges Tierlotto; Farm Lotto; Fit-In Picture Lotto; Fleckis Lotto; Floral Loto; Flower Lotto; La France Pittoresque; Fullt kort; Game of Lotto; Gartenlotto; Lo Giuoco del Lotto d'Italia; Das große Tierlotto; Historical Lotto; House; House! or Lotto; Housee; Housey-House; Housie; Janosch Lotto; Jeu d' Herbes Medicinales par Kneipp; Jeu de Loto; Les Jeux de Lucky Luke Loto et Dominos; Jeux des 4 Saisons; Juego de la Loteria; Kikker & Vriendjes Lotto; Der Kinderfreund  mit seiner Glücksbude; Kinderlotto; Kunst-Lotto; L'Histoire de France; Lernlotto Blumen; Lernlotto Fruchte; Let's Play Lotto; Linofive; Little Dot's Picture Lotto Game; Loteria; Loteria de los Animales; Loto; Loto dauphin; Le Loto De Babar; Loto de Géographic; Loto de l' Histoire de France; Loto de la Route; Le Loto de Oui-Oui; Loto Des Chateaux de France; Loto Des Drapeaux; Loto des Métiers; Loto des Teuf-Teuf; Loto Enfantin Jeu Amusant; Loto Europeen; Loto Mineralogique; Lotteri; Lotteria dei Piccoli; Lotterie; Le Lotto; Lotto (Housey-Housey); LOTTO 5; Lotto Boy Scouts Edition; Lotto Club Set; Lotto Dom; The Lotto Game!; Der Lotto König; Lotto med femton kulor; Lotto or ""Housey-Housey""; Lotto or House; Lotto or Housey-Housey; Lotto Photo; Lotto Verkeer; Lotto Vögel; Lotto Zoo; Lotto-Stern; Lucky Luke Vise Juste Loto; Das Lustige Bilder-Lotto; Lustiges ein mal eins; Magic Roundabout TV Lotto; Mainzel-Männchen; Mal- u. Haustier- Lotto; Märchen-Lotto; Märchenlotto; Märchenlotto + Puzzle; Marvel Avengers Assemble Lotto; Mathematical Quodlibet; Maxi-Lotto Spielzeug; Mein erstes Lotto; My World My Lotto; Naturgeschichtliches Lotto; Das neue Lotto; Neuestes Würfel Lottospiel; Nicki Lotto; Noddy Loto; Noddy Picture Lotto; Nursery Lotto, An Interesting Round Game; Oiseaux du Monde; Old MacDonald Lotto; Philipp die Maus Lotto; Picture-Lotto; Play and Learn Lotto; The Popular Game of Lotto; Popular Lotto; Preschool Lotto Game; Prof. Grzimeks Tier-Lotto; Pumuckl-Lotto; Rätsel-Lotto; Das Regenbogenfisch Lotto; Regnelotteriet; Sesam Bild-Lotto; Ships & Boats Lotto; Spelling Lotto; Spreekwoorden-Lotto; Städte des deutschen Reiches; Stavelotteri; Super Tombola Special; Super Tombolina; Tal Lotteri; Tallotteri; Technisches Wissen und Können; Tier aus aller Welt; Tier-Lotto; Tiere aus aller Welt-Lotto; Tiere-Lotto; Tierkinder-Lotto; Tierlotto; Tingeling; Tom & Jerry Loto; Tombola; Tombola 48; Tombola degli ambienti lessicali; Tombola degli animali; Tombola: The Italian Game of Chance; Trafikk Lotto bil-båt-tog-fly; U.S.A. Lotto; Verkehrs-Lotto; Visitons La Ferme Un Loto; Vogelbilder-Lotto; Walt Disney Lotto; Was kostet das?; Welt der Abenteuer; Wer wie was; What is This?; Wide World Lotto; Zahlen-Lotto; Zeitvertreibende Lotterie mit Gewinn und Verlust für junge Leute; Zoo Lotto; Zoological Lotto; Γεωγραφική Τόμπολα Ελλάδος; Κασπερ ΤΟΜΠΟΛΑ ΕΙΚΟΝΩΝ; Μίκυ Μάους Τόμπολα; Τόμπολα; Лото на селу",1530,"[See also Loteria, under a separate entry]&#10;&#10;A precursor to Bingo, Lotto utilizes cards showing pictures or numbers in a grid, commonly 4x4 pictures or 3x6 numbers. The same images or numbers are scattered on different cards. A set of tiles or small cards is used to call out which image/number the players should cover up with a chip. The first to get one row complete wins a round. Many people can play at once; one older game was designed for large groups of up to 48 players.&#10;&#10;Ther...",2,48,30,30,30,3,Children's Game; Party Game,,"Traditional Games: Bingo; Animals: Apes / Monkeys; Animals: Bears; Animals: Bees; Animals: Cats; Animals: Chickens / Roosters; Animals: Dinosaurs; Animals: Dogs; Animals: Elephants; Animals: Fish / Fishes; Animals: Mice; Animals: Rabbits / Hares; Animals: Tigers; Animals: Zebras; Authors: Astrid Lindgren; Authors: Enid Blyton; Authors: Mother Goose; Books: Babar; Books: Pippi Longstocking; Books: The Rainbow Fish; Books: Winnie the Pooh; Brands: Disney; Characters: Bamse; Characters: Benjamin the Elephant; Characters: Bozo the Clown; Characters: Kikker & Vriendjes; Characters: Mickey Mouse; Comic Books: Harvey Comics; Comic Books: Lucky Luke; Comic Books: Marvel Universe; Components: 3 x 3 Grids; Containers: Tin/Metal Box; Containers: Tubes; Country: France; Country: USA; Creatures: Ghosts; Creatures: Monsters; Folk Tales & Fairy Tales: Little Red Riding Hood; Folk Tales & Fairy Tales: Puss in Boots; Holidays: Christmas; Movies: Frozen; Movies: Monsters, Inc.; Movies: Pixar; Series: Noris-Fernsehspiele (Noris-Spiele); Theme: Clowns; Theme: Flowers; Theme: Scouting / Guiding; Theme: Superheroes; Theme: Traffic / Driving; Theme: Zoos, Aquaria, Safari Parks; TV Shows: Casper the Friendly Ghost; TV Shows: Hanna-Barbera; TV Shows: Maya the Bee; TV Shows: Sesame Street; TV Shows: Tom & Jerry; TV Shows: Unser Sandmännchen",(Uncredited),Rune Andréasson; Dick Bruna; Maurice de Bevere; Jean de Brunhoff; Jens Julius Hansen; Eric Hill; Janosch; Rolf Kauka; Günther Marks; Gisela Mohr; Marcus Pfister; Eelco Martinus ten Harmsen van der Beek; Barbara von Johnson,"(Public Domain); (Unknown); Abel Klinger; AK Spiele Heimchen; Alga; Amor Spielefabrik; ASS Altenburger Spielkarten; Atmosphere; B & S Company; Bayerwald Spiele; Berliner Spielkarten; Berwick's Toy Co. Ltd.; Biserka; Blatz; British Games Ltd (BGL); Brybelly; Built-Rite; Carlit; Carls Stenders Kunstforlag; Cayro, The Games; Chad Valley Co Ltd.; Clementoni; Codeg; Dal Negro; Dalmau Carles Pla S.A.; danspil; Diset S. A.; Drechsler; E. E. Fairchild Corporation; E. S. Lowe Company Inc.; East Hull Press; Éditions Gladius International, Inc.; Edizione Marca Stella; Edizione Marca Stella; Edizioni Cicogna; eeBoo; F.X. Schmid; Flamenco; Franz Schmidt; Gayplay; Gibsons; Glevum Games; Granna; H. P. Gibson & Sons; Harett-Gilmar; Harlesden Games; Hartwig & Vogel; Hausser; Heros; I. P. C. Universal Corp.; Ideal; J. A. Endtersche Verlagsbuchhandlung; J. Van Brunschot; J.L.; Jeux Stella; John Jaques of London; John Sands Pty Ltd; Jos. Scholz; Jugoslovenska knjiga; Jumbo; K & C Ltd; Kärnan; Karto; Klee; KOSMOS; Lisciani Giochi; M. Dittert & Co; Majora; McLoughlin Brothers; Medallion Press; Merit; Milton Bradley; Mulder; N.W. Damm & Søn (Damm); Nathan; National Game Company; Noris Spiele; North-South Books; Nürburg Spiele; Nürnberger-Spielkarten-Verlag; Orchard Toys; Orda Industries Ltd.; Otto Maier Verlag; Palet spil; Papita; Parker Brothers; Pestalozzi-Verlag; Piatnik; Pressman Toy Corp.; Prestel Verlag; Ravensburger; Remoundo; Rudolf Forkel KG; Sala; Saml. Gabriel Sons and Company; Saussine Editeur; Schmidt Spiele; Selecta Spielzeug; Spear's Games; SPIKA GmbH; Tactic; Thomas Salter Ltd; Toytown Company; Unger Spiele; Usborne; Verlag Paul Schwarz; Volumétrix; Waddington Sanders Ltd.; Waddingtons; ΕΡ.ΚΑ.Π.; Ο.Β.Ε.Π.Κ.",28702,3.75266,5.23894,376,1.2143,706
1115,Poker,Poker; 'Hold em or fold em'; 300-Piece Poker Set; 7-card Stud; Así se Juega al Poker; Asterix bei den Schweizern: Poker; Asterix Chez les Helvetes: Jeu de Poker; Casino Style Texas Hold'Em Poker Set; Cigar Poker; Complete Texas Hold 'Em; Five Card Draw; Meister Poker; No. 18 Poker; Omaha 8; Opti Supreme Poker; Pink Poker Night; Poker Bridge; Poker Deck; Poker for Dummies; Poker Francais; Poker Keychain; Poker Set; Pokereasy; Pokeri; Pokker; Seven Card Stud; Strip Poker; Texas Hold 'Em for Juniors; Texas Hold 'Em Poker; Texas Hold 'Em Poker Set; Texas Hold 'Em Tournament Poker; Texas Hold'em; Texas Holder; Tourism: Poker; Werewolf: The Wild West – Poker Deck; Πόκερ; 梭哈; 냥트; 포커,1810,"Poker is played with a standard deck of 52-cards, and sometimes Jokers are added as wild cards. The object of the game is to win the pot which contains all the bets the players have made in a deal.  Players are dealt cards which are usually reduced to a Poker hand of five (5) cards. Betting and bluffing are used in rounds until all bets are squared up, or until all other players have conceded the pot (folded). If all bets have been squared up, the rounds are followed by a &quot;showdown&quot; in...",2,10,60,60,60,12,Bluffing; Card Game,Betting and Bluffing; Player Elimination; Set Collection,Traditional Card Games: Poker; Components: Traditional Playing Cards; Digital Implementations: Board Game Arena; Digital Implementations: Tabletopia; History: American Old West (Wild West); Promotional: Board Games; Series: Games for Dummies,(Uncredited),René Goscinny; Albert Uderzo,"(Public Domain); (Self-Published); (Unknown); AG Müller (AGMüller); Ambassador Games (Merchant Ambassador); ASS Altenburger Spielkarten; Basic Fun, Inc.; Berliner Spielkarten; Capitol Carta Roma; Cardinal; Coach House Games, Inc.; Coca-Cola; Editions ATLAS; Endless Games (I); Excalibur Electronics; F.X. Schmid; Front Porch Classics; Fundex; Helmut Lingen Verlag; Heraclio Fournier; Jax, Ltd.; Marigó; Offason; Piatnik; Prime Promotion; Rosiness; Skor-Mor; Spear's Games; Spin Master Ltd.; Starz Entertainment; Tactic; TS Spielkarten; TV Products USA Inc; Uitgeverij van der Meulen; The United States Playing Card Company; University Games; Waddingtons; White Wolf Entertainment AB",1372,6.70697,6.45736,11659,2.4303,11177
111999,Pharaoh Code,Pharaoh Code; Kod Faraona; Opération Pharaon; Pharao Code; Pyramid Code; Код Фараона; צופן הפירמידה; 法老密碼; 파라오 코드,2011,"In Pharaoh Code, you're trying to claim as many scarabs as you can by solving the aforementioned codes. To set up the game, you divide the number tiles into four piles based on the number of scarabs on them, with more scarabs typically signifying larger numbers. To create the number pyramid, you lay out one tile with four scarabs, two tiles with three, and so on.&#10;&#10;On a turn, one players rolls the three dice &ndash; an octahedron, a decahedron and a dodecahedron &ndash; then all players t...",2,5,20,20,20,10,Dice; Educational; Math; Number; Party Game; Real-time,Dice Rolling,,Jung-Hun Lim,Jun-Ho Na,AMIGO; Brain Games; Broadway Toys LTD; FoxMind Israel; G3; Gigamic; Korea Boardgames; Lautapelit.fi; Lifestyle Boardgames Ltd,15064,5.94319,5.53378,277,1.4,355
112,Condottiere,Condottiere; Кондотьер; رکب (Rakab); 傭兵隊長; 傭兵隊長新版,1995,"It is 13th century Italy. Trade is flourishing between the city-states and the Levant. Venice, Florence, and Genoa are all bursting with wealth. However, each city-state is also plagued with a weak national army, leaving them defenseless against invasion from their envious neighbors. Enter the Condottiere. &#10; As veteran English soldiers returned from the Crusades, Italy found itself with an influx of desperate and capable men. These hired swords were contracted to fight for individual city-st...",2,6,45,20,45,10,Bluffing; Card Game; Medieval; Negotiation,Area Majority / Influence; Auction / Bidding; Constrained Bidding; Hand Management,"Admin: Better Description Needed!; Cities: Florence (Tuscany, Italy); Components: Map (Continental / National scale); Components: Wooden pieces & boards; Country: Italy; Digital Implementations: VASSAL; History: Italian City-States; Series: Fantasy Flight Silver Line",Dominique Ehrhard; Duccio Vitale; Justin Kemppainen,Dominique Ehrhard; John Goodenough; Serge Hochain; Tomasz Jedruszek; Scott Nicely; Mohammad Noureddine; David Palumbo; Samuel R. Shimota,Eurogames; (Unknown); Arclight Games; Delta Vision Publishing; Descartes Editeur; Edge Entertainment; Fantasy Flight Games; Galakta; Giochi Uniti; Heidelberger Spieleverlag; Hobby World; Lautapelit.fi; Nexus Editrice; Roomiz Games; Ubik; Z-Man Games,1017,6.88624,6.61935,10594,1.9521,13631
117555,CLACK!,CLACK!; Clac Clac; Clack!; Crazy Clack!; Cvak!; Halli Klack!; Klack!; Klik!; קלאק,2012,"CLACK! is both the name of the game and the sound that the magnetic discs in the game will make when you slap one against another &ndash; and slap them together you will as you're trying to claim the right discs as quickly as possible.&#10;&#10;To set up the game, lay out all 36 discs face up so that everyone can see the colored symbols on them. One player rolls the two dice &ndash; one showing colors, the other symbols &ndash; then everyone simultaneously tries to grab any discs showing the col...",2,6,10,10,10,4,Children's Game; Party Game; Real-time,Dice Rolling; Pattern Recognition; Speed Matching,Components: Dice with Icons,Haim Shafir,Markus Wagner,AMIGO; 999 Games; Brain Games; Corfix; Gigamic; Lautapelit.fi; Mercurio; Shafir Games (המשחקים של חיים שפיר); VR Distribution,16738,5.73291,5.526,371,1.0714,872
117558,Escape: Fighting for Freedom,Escape: Fighting for Freedom; Escape,2013,"Escape: Fighting for Freedom takes place in a post-apocalyptic world in which artificial intelligence will ensure the good of humanity... A little too much for some humans, who revolt. The game focuses on the confrontation between the resisting humans and robots.&#10;&#10;Escape is a light miniatures wargame, taking place in the Eden universe. The game is designed for two players: one player takes control of the International Scientific Council (I.S.C.) and its force of robots; the other player ...",1,6,60,60,60,12,Exploration; Fighting; Miniatures; Science Fiction,Action Points; Area Movement; Cooperative Game; Variable Player Powers,Crowdfunding: Kickstarter,Mohamed Ait-Mehdi; Mélanie Marlier; Thibault Sarels; Fabrice Tran,Mohamed Ait-Mehdi,Happy Games Factory; Taban Miniatures; Thermopyles,20063,7.83636,5.51419,33,2.3333,110
118,Modern Art,Modern Art; Art Moderne; Arte Moderna; Arte Moderno; Современное искусство; Сучасне мистецтво; هنر مدرن; スタンプス (Stamps); モダンアート; 現代藝術; 現代藝術 (现代艺术); 모던 아트,1992,"Buying and selling paintings can be a very lucrative business.  Five different artists have produced a bunch of paintings, and it's the player's task to be both the buyer and the seller, hopefully making a profit in both roles.  He does this by putting a painting from his hand up for auction each turn.  He gets the money if some other player buys it, but must pay the bank if he buys it for himself.  After each round, paintings are valued by the number of paintings of that type that were sold.  T...",3,5,45,45,45,10,Card Game; Economic,Auction / Bidding; Auction: English; Auction: Once Around; Auction: Sealed Bid; Auction: Turn Order Until Pass; Commodity Speculation; Hand Management; Victory Points as a Resource,Components: Player Screens; Misc: Dice Tower Hall of Fame; Misc: LongPack Games; Series: 31 Minutos (Fractal Juegos); Series: Book Box (DiceTree); Theme: Art; Theme: Fine Art and Art Museums; Theme: Painting / Paintings,Reiner Knizia,Carole Carrion; Manuel Carvalho; Chen Cheng-po; Mike Doyle (I); Pete Fenlon; Gianfranco Giordano; Paul Laane; Ramon Martins; Daniel Melim; Rafael Silveira; Sigrid Thaler; Zeilbeck & Natzeck Design Company,"Hans im Glück; Arrakis Games; CMON Global Limited; DiceTree Games; Drosselmeyer & Co. Ltd.; Fractal Juegos; Galápagos Jogos; GeGe Co. Ltd.; Kaissa Chess & Games; Land of Beautiful Mind (سرزمین ذهن زیبا); Lautapelit.fi; Lavka Games; Lighthouse Games; Matagot; Mayfair Games; New Games Order, LLC; Odysseia Jogos; Oink Games; Pegasus Spiele; Phantasia Co., Ltd; Rebel Sp. z o.o.; Wargames Club Publishing; WoodCat",216,7.51576,7.32304,24205,2.2856,31870
118258,Zebra-Schwein,Zebra-Schwein; AniMix,2012,"Zebra-Schwein will have your children committing unspeakably horrible genetic experiments in the comfort and safety of their own home.&#10;&#10;No, actually Zebra-Schwein only has children draw unspeakably horrible genetic experiments, specifically the combination of two animals as determined by a secret die roll. To set up the game, lay out the six animal tiles in a circle; each tile shows a die face next to the animal: zebra is 1, mouse is 2, etc.&#10;&#10;On a turn, a player secretly rolls tw...",3,6,20,20,20,6,Animals; Children's Game; Party Game,Line Drawing,Animals: Camels; Animals: Dogs; Animals: Pigs; Animals: Snakes,Emely Brand; Lukas Brand,Anne Pätzke,Competo / Marektoy; Schmidt Spiele,22856,5.79167,5.50484,36,1,66
118568,Ubongo! Junior,Ubongo! Junior; Bamses Ubongo; Ubongo Junior,2012,"Ubongo Junior takes the familiar tile-laying, pattern-matching play from Ubongo and scales it down for a younger audience.&#10;&#10;In Ubongo Junior, each player starts the game with nine tiles &ndash; each of a different color and shape, and each showing an animal &ndash; along with a stack of seven puzzle boards. The puzzle boards show an arrangement of squares that can be covered with two tiles (on the easy side) or three (on the hard side); the tiles to be used are depicted on the board.&#10...",2,4,20,20,20,5,Puzzle; Real-time,Pattern Recognition; Real-Time; Tile Placement,Characters: Bamse; Components: Gems/Crystals; Components: Sand Timers; Game: Ubongo; Versions & Editions: Junior Versions of Grown-Up Games,Grzegorz Rejchtman,Rune Andréasson; Annette Nora Kara,KOSMOS; Devir; Four Esses; Kärnan; White Goblin Games,8088,6.63288,5.6199,286,1.5714,839
