bgg_id,primary_name,all_names,year,description,min_players,max_players,playing_time,min_play_time,max_play_time,min_age,categories,mechanics,families,designers,artists,publishers,bgg_rank,average_rating,bayes_average,users_rated,weight,owned
271324,It's a Wonderful World,It's a Wonderful World; É Um Maravilhoso Mundo; Nowy wspaniały świat; Svět divů; Egy szép új világ; Eine wundervolle Welt; Един прекрасен свят; Цей дивовижний світ; Этот безумный мир; สร้างโลกมหัศจรรย์; イッツアワンダフルワールド; 美丽新世界; 원더풀 월드,2019,"In It&rsquo;s a Wonderful World, you are an expanding Empire and must choose your path to your future. You must develop faster and better than your competitors. You&rsquo;ll carefully plan your expansion to develop your production power and rule over this new world.&#10;&#10;It&rsquo;s a Wonderful World is a cards drafting and engine building game from 1 to 5 players. Each round, players will draft 7 cards and then choose which ones will be recycled to immediately acquire Resources, and which on...",1,5,45,45,45,14,Card Game; Civilization; Economic; Science Fiction,Closed Drafting; End Game Bonuses; Hand Management; Income; Set Collection; Simultaneous Action Selection; Solo / Solitaire Game; Variable Player Powers,Components: Multi-Use Cards; Crowdfunding: Kickstarter; Crowdfunding: Spieleschmiede; Digital Implementations: Board Game Arena; Digital Implementations: Game Park; Game: It's a Wonderful World; Mechanism: Tableau Building; Players: Games with Solitaire Rules,Frédéric Guérard,Anthony Wolff,La Boîte de Jeu; Blackrock Games; Engames; Evrikus; Fantasmagoria; FoxGames; Galápagos Jogos; Geronimo Games; Kilogames; Kobold Spieleverlag; Lautapelit.fi; Lucky Duck Games; MEBO Games; MTS Games; One Moment Games; Origames; Reflexshop; Studio Supernova; TLAMA games; Tranjis Games,175,7.64348,7.396,21589,2.3247,28152
271615,The Quest for El Dorado: The Golden Temples,The Quest for El Dorado: The Golden Temples; Eldorádó legendája: Az aranyváros templomai; Quest for Eldorado: Golden Temples; Wettlauf nach El Dorado: Die Goldenen Tempel; Wyprawa do El Dorado: Złote Świątynie; De Zoektocht naar El Dorado: De Gouden Tempels,2019,"In The Quest for El Dorado: The Golden Temples, which can be played as a standalone game or combined with The Quest for El Dorado, as well with its expansions, players have now reached the legendary city of gold and they have started to explore it. What will they find there?&#10;&#10;",2,4,60,30,60,10,Adventure; Exploration,"Deck, Bag, and Pool Building; Grid Movement; Hand Management; Modular Board; Open Drafting; Pick-up and Deliver; Race",Components: Multi-Use Cards; Continents: South America; Game: The Quest for El Dorado; Region: Amazon Rainforest; Theme: Tropical,Reiner Knizia,Vincent Dutrait; Franz Vohwinkel,Ravensburger; 999 Games; Lautapelit.fi; MEEPLE; Nasza Księgarnia; Reflexshop,1315,7.64135,6.47618,1934,2,5261
271774,Sherlock Express,Sherlock Express; Ντετέκτιβ αστραπή; 탐정 9단 셜록,2019,"Help Sherlock unmask culprits and cunningly use clues to find the accomplice of Moriarty, his sworn enemy!  If no one is guilty, capture Moriarty himself. Everyone is a suspect ... Until proven innocent!&#10;&#10;Sherlock Express is a real-time game. Each turn players compete to the first to arrest the correct suspect; which is correct is determined by a set of simple rules.&#10;&#10;",2,6,10,10,10,7,Card Game; Real-time,Pattern Recognition; Real-Time,Admin: Better Description Needed!; Books: Sherlock Holmes,Henri Kermarrec,Bénédicte Ammar,Blue Orange (EU); Blue Orange Games; Happy Baobab; HUCH!; Kaissa Chess & Games; Lautapelit.fi; Nilco S.A.; PaperGames (III),13658,6.0346,5.5421,269,1,637
2719,Connect Four,Connect Four; 4; 4 à la Suite; 4 Across; 4 em Linha; 4 en Línea; 4 en Raya; 4 Gewinnt; 4 gewinnt; 4 Gewinnt FC Schalke 04; 4 in a Line; 4 in a Row; 4 Oczka; 4 op een Rij; 4 på rad; 4 Verliert; 4 בשורה; 4-es sor; 4-In-A-Row Paw Patrol; 4er Reihe!; 4GEWINNT; 4x is de Winnaar; 4x Vier op een rij; Acierta 4; Asterix und Kleopatra: Vier gewinnt; Ball Toss 4; Bingo Chess; The Captain's Duel; The Captain's Mistress; The Captain's Mistress Game; Clone 4; Coloca 4; Conecta 4; Connect 4; Connect Four/ Puissance 4; Connecta 4 super; David vs. Goliath: Four in a Row Game; Fire på Stribe; Forza 4; Four in a Row; Four to Win; Four-in-a-Row; Frozen 3D Tic Tac Toe; Fyra i rad; Gewinn mit ...; Gewinn mit 4; Gewinn mit 4!; Go for 4; Hedef 4; Koordina; Lig 4; Linea 4; Magnetic Fridge Four-In-A-Row; Master Score 4; Mini Line Up 4; Négy a nyerő!; Neljän suora; Noah's Ark: Four in a Row Game; Das Original 4 gewinnt; Le Passe Temps; Penguin Parade; Puissance 4; Quatre en Ligne; Quattro; Quattro: Gewinn mit 4; Reis Vier op'n rij; Reise Vier Gewinnt; Score 4; Spade Floral Four in a Row Game; Spiel mit 4; stop 4; Super Quatre; Take Four; Travel Connect Four; Travel Four in a Row Counter Strategy; Värisuora; Die verflixten 4; die Vier; Vier achter elkaar; Vier gewinnt; Vier Gewinnt; Vier in einer Reihe; Vier in einer Reihe auf Reisen; Vier op 'n rij; Vier op een rij; Vier Wint; Vierer-Champion; Vierer-Reihe; Wer hat die 4?; World's Smallest Connect 4; WWF 4 em linha Madagascar; Zet er 4; Κοντρα-4; Σκορ 4; Собери 4; ארבע בריבוע; 사목 놀이; 입체 4목,1974,"Connect 4 is a well known vertical game played with &quot;checkers&quot; game pieces, although it is more akin to Tic-Tac-Toe or Go Moku.&#10;&#10;The board is placed in the stand to hold it vertically and the players drop game pieces into one of the seven slots, each of which holds up to six game pieces, until one player succeeds in getting four in a row, whether horizontally, vertically, or diagonally.&#10;&#10;The game is non-proprietary.  More elegant, wooden versions can be found under the ...",2,2,10,10,10,6,Abstract Strategy; Children's Game,Pattern Building,Animals: Dogs; Animals: Penguins; Brands: Disney; Category: Combinatorial; Category: n in a row; Comic Books: Asterix; Components: 3-Dimensional (3D); Components: 6 x 6 Grids; Components: 6 x 7 Grids; Components: 7 x 7 Grids; Components: Magnets; Digital Implementations: Abstract Play; Digital Implementations: Ai Ai; Digital Implementations: Board Game Arena; Digital Implementations: igGameCenter; Digital Implementations: Little Golem; Digital Implementations: Yucata; Game: Connect 4; Mechanism: 4 in a Row; Movies: Frozen; Movies: Star Wars; Players: Two-Player Only Games; Religious: Christianity; Religious: Noah and the Ark; Series: GoPlay; Series: World's Smallest (Super Impulse); Sports Teams: Schalke 04; TV Shows: Paw Patrol; TV Shows: SpongeBob SquarePants,Ned Strongin; Howard Wexler,(Uncredited),"Milton Bradley; (Unknown); ABRA; Aero Lloyd; Alga; Arxon; ASS Altenburger Spielkarten; Aventis; Berliner Spielkarten; Blip Toys LLC.; Cactus Game Design; Cayro, The Games; CHH Games; Creative Crafthouse; Daddy-O Productions; Dilemma Games; Editions ATLAS; Estrela; Falomir Juegos; Flying Tiger Copenhagen; Fratelli Fabbri Editori  (Fabbri Editore); Fundex; Gibsons; El Greco; HABA; HaPe International; Hasbro; Hearth & Hand with Magnolia; IMC Games; Impag Toys Europe B.V.; Innovakids GmbH; Inovac Rima SA; International Playthings, Inc.; Invicta Games; Jay Franco and Sons; Joen; John Jaques of London; Just Play; Kod Kod; Korea Boardgames; Lagoon Games; Leksam; Loncraine Broxton & Partners Ltd; MB Giochi; MB Jeux; MB Juegos; MB Spellen; MB Spiele; Melissa & Doug; Meridian Point Products; MIKA; Monkey Pod Games; N.W. Damm & Søn (Damm); Nilco S.A.; Noris Spiele; Northwest Corner, Inc.; Oriental Trading Company; Ottensten; Paul Lamond Games Ltd; Pavilion; Peri Spiele; Pin International; Plasticart; Plastolus Szarvas; Pressman Toy Corp.; Pusser's; Ravensburger; Remy Martin; RIWA Spiele; Ruibal Hermanos S.A.; Schmidt Spiele; Schylling; Simba Toys; Small Foot Company; Sparkasse; Spear's Games; Spin Master Ltd.; Sterling Games; Stillmark Oy; StirlingFox; Super Accord; Super Impulse; Swing Ltd.; Terra Toys; Tesco; Tiimari; Trixy Games; Unikatoy; Westside Fun Games; WHSmith; Winning Moves Germany; Winning Solutions (WS Game Company); Woodstock Spiele; ZPH Elbar",28738,4.99194,5.03214,9903,1.1844,15067
27225,Bananagrams,Bananagrams; Bananagrams: Signature Edition; Big Letter Bananagrams; Jumbo Bananagrams; World's Smallest Banagrams; 香蕉拼字; 바나나그램스,2006,"Bananagrams is a fast and fun word game that requires no pencil, paper or board, and the tiles come in a fabric banana-shaped carrying pouch. One hand can be played in as little as five minutes. Much like Pick Two!, but without the letter values.&#10;&#10;Using a selection of 144 plastic letter tiles in the English edition, each player works independently to create their own 'crossword' faster than one's opponents. When a player uses up all their letters, all players take a new tile from the poo...",1,8,15,15,15,7,Real-time; Word Game,Race; Real-Time; Spelling; Tile Placement,Category: Crossword Games; Containers: Unique Shape; Containers: Zippered Pouch; Digital Implementations: VASSAL; Food & Drink: Bananas; Game: Bananagrams; Players: Games with Solitaire Rules; Series: World's Smallest (Super Impulse),Rena Nathanson; Abe Nathanson,Kendra Harrington; Sandy Nathanson; Aaron Nathanson,"Bananagrams, Inc.; 999 Games; AURUM, Inc.; Broadway Toys LTD; DV Games; Galápagos Jogos; Game Factory; KOSMOS; Ludicus Games; Lúdilo; MINDOK; Nordic Games GmbH; Peliko Oy; Super Impulse; Trefl; Vennerød Forlag AS",2094,6.40967,6.213,12782,1.2935,28223
272516,Emotify,Emotify,2016,"In this party game 2 teams play against each other. The goal of the game is to get rid of all his EMOTIS. &#10;For this every team is given a writing board, a felt-tip pen and a screen. Without looking, every team take 10 EMOTIS chips from a bag and place them behind their screen.&#10;The team that starts chooses a player who spins the hand of a rotating dial and carries out the instructions. The dial is split into 10 fields:&#10;&#10;     6 themes with a maximum number of EMOTIS(Leisure, People...",4,20,30,30,30,10,Party Game; Word Game,Cooperative Game; Team-Based Game,,,,Jumbo,,4.10526,0,19,0,77
273065,Genius Square,Genius Square; Batalla de Genios; The Genius Square; 機智方塊,2018,"Roll The Dice &amp; Race Your Opponent To Complete The Square!&#10;&#10;A worthy winner of the HPC Game Of The Year 2018/19 award, this outstanding puzzle game is every bit as clever as its name suggests. Each player receives their own 6x6 grid and a set of the nine different shapes, plus seven &lsquo;blocker&rsquo; pieces. Roll the seven dice together and place a blocker in each of the co-ordinates that appear on the faces. Now race to fill every other space on the grid, before your opponent.&#...",1,2,30,5,30,6,Children's Game; Dice; Educational; Party Game; Puzzle,Dice Rolling; Pattern Recognition; Race; Square Grid; Tile Placement; Variable Set-up,,Salim Berghiche; Alain Brobecker; Cameron Browne,,"The Happy Puzzle Company; Smart Toys and Games, Inc.; Broadway Toys LTD; Lúdilo; TWOPLUS Games",6236,6.72697,5.68964,454,1,1305
275281,Polar Panic,Polar Panic; Jég résen,2018,"In this chilly challenge players go ice fishing! Spread the cards over the table face down, with the ice hole side facing up. On each turn a player flips just one card, placing it back face up on the table. When any player sport two or more cards that have one or more fish in common they try to catch these as fast as possible so they can collect it.&#10;&#10;Be the first to catch the matching fish and prove that you are the best of all fishers in this chilly challenge! But beware the polar bear,...",2,6,10,10,10,6,Animals; Party Game; Real-time,Memory,Animals: Bears; Animals: Fish / Fishes; Containers: Round Boxes; Containers: Tin/Metal Box; Theme: Fishing / Angling,Martin Nedergaard Andersen,,AMIGO; Cheatwell Games; Reflexshop,24133,5.62903,5.49977,31,1,87
27532,Vineta,Vineta; Atlantis; Atlantyda; Waka-Waka Island,2008,"In Vineta, 2 to 6 players take on the roles of angry Norse Gods, seeking to sink the city of Vineta beneath a succession of pounding waves. However, each player is secretly assigned one of nine city districts to protect. Likewise, each player secretly protects one color of houses.&#10;&#10;By use of cards, players send waves against districts, joining together to sink them and moving houses in and out of threatened districts. At the end of each round, the district that has the most waves played ...",2,6,45,45,45,10,Bluffing; Fantasy,Map Reduction; Simultaneous Action Selection,Series: Games Collection (Immortal Eyes),Mauricio Miyaji; Fabiano Onça; Mauricio Vismona,Martin Hoffmann; Tomasz Larek; Claus Stephan,Immortal Eyes Games; Trefl; Winning Moves Games (USA); Winning Moves Germany,5801,6.19667,5.71246,1096,2.0106,1707
27627,Talisman: Revised 4th Edition,Talisman: Revised 4th Edition; Talisman (4th Edition); Talisman The Magical Quest Game; Talisman:  El Juego de Aventuras y Fantasía; Talisman: Die Magische Suche (4. Edition); Talisman: Dobrodružství meče a magie; Talisman: Dobrodružství meče a magie (revidovaná 4. edice); Talisman: El Juego de Aventuras y Fantasí; Talismán: El Juego de la Búsqueda Mágica; Talisman: Il Gioco delle Avventure Magiche; Talisman: Le jeu des quêtes magiques (4ème édition révisée); Talisman: Magia i Miecz; Talisman: O Mágico Jogo de Aventura; Talisman: Varázslatos küldetések; Talisman: Магическое приключение (4е переработанное издание); Талисман: 4-я редакция; טליסמן; タリスマン 基本セット 第４版改訂版 日本語版; 圣符国度; 탈리스만 (개정 4판),2007,"Theme:&#10;&#10;Talisman is an adventure board game set in a high fantasy medieval world.  Players have 14 characters to choose from all based on role playing archetypes, such as heroes, wizards, villains, thieves, monsters, etc.  The game makes players feel they are traveling the world to find equipment, weapons, ancient relics, and companions that will help them on their quest to acquire the Crown of Command.  Along the way they visit various locales in the worlds, battle each other and fantas...",2,6,90,90,90,13,Adventure; Exploration; Fantasy; Fighting,Dice Rolling; Role Playing; Roll / Spin and Move; Take That; Variable Player Powers,Components: Miniatures; Digital Implementations: Google Play; Digital Implementations: Steam; Game: Talisman; Misc: LongPack Games,John Goodenough; Robert Harris,Massimiliano Bertolini; Marjorie Davis; Ralph Horsley; Jeremy McHugh; WiL Springer; Sean Turtle; Teejay Ralph Villahermosa,Black Industries; ADC Blackfire Entertainment; Delta Vision Publishing; Devir; Edge Entertainment; Ediciones MasQueOca; Fantasy Flight Games; Galakta; Game Harbor; Games Workshop Ltd.; Giochi Uniti; Heidelberger Spieleverlag; Hobby Game Mall; Hobby Japan; Mandoo Games; Matagot; Monkey Time; Nexus Editrice; Pegasus Spiele; REXhry; Smart Ltd,2019,6.50574,6.23185,15928,2.1705,24952
2763,Touché,Touché; 2001; La 3ème Force; Magic 4; Magische-Vier; Magnet 4; Magnet 4: Magic Power; Treffer; Turncoat; 턴코트,1977,"Each player has 6 pieces lined up on his side of a 5&times;5 grid, either the rectangular or the rounded pieces. Pieces are transparent, and inside them are magnetized metal disks, one side red, the other white. In this distant variation on Tic-Tac-Toe, your ultimate goal is to arrange that 4 disks of your color are in a row, regardless of the shapes of the pieces. Under the board are magnetic strips of unknown polarity. As you place a piece into a new space, it might stay as it is, but it could...",2,2,30,30,30,8,Abstract Strategy; Memory,Memory; Tile Placement,Components: 5 x 5 Grids; Components: Magnets; Players: Two-Player Only Games,Howard Wexler,,"Capiépa Éditeur: Jeux Éducatifs; CBS Electronics; Discovery Toys; Diset S. A.; Gabriel; IRWIN Games; Irwin Toy Ltd.; James Industries, Inc.; Jumbo; Korea Boardgames; N.W. Damm & Søn (Damm); Parker Brothers; Parker Spiele; Peter Pan Playthings; University Games",18631,5.72448,5.51899,243,1.6429,631
276894,Ticket to Ride: London,"Ticket to Ride: London; Les Aventuriers du Rail: Londres; Jízdenky, prosím!: Londýn; Ticket to Ride: Londra; Ticket to Ride: Londres; Wsiąść do Pociągu: Londyn; Zug um Zug: London; チケット・トゥ・ライド: ロンドン",2019,"Ticket to Ride: London features the familiar gameplay from the Ticket to Ride game series &mdash; collect cards, claim routes, draw tickets &mdash; but on a scaled-down map of 1970s London that allows you to complete a game in no more than 15 minutes.&#10;&#10;Each player starts with a supply of 17 double-decker buses, two transportation cards in hand, and one or two destination tickets that show locations in London. On a turn, you either draw two transportation cards from the deck or the displa...",2,4,15,10,15,8,Trains,Hand Management; Network and Route Building; Open Drafting; Set Collection,"Cities: London (England, UK); Components: Map (City Scale); Country: England; Country: United Kingdom; Game: Ticket to Ride (Official); Series: Ticket to Ride Cities (Days of Wonder)",Alan R. Moon,Cyrille Daujean; Julien Delval,Days of Wonder; ADC Blackfire Entertainment; Galápagos Jogos,1107,7.06432,6.57512,5396,1.3363,14560
2792,Coco Crazy,Coco Crazy; Monkey Mix-up; Το κυνήγι της καρύδας,1992,"Six coconuts each contain six monkeys (&quot;bobbles&quot;) of identical colour.  Each player is trying to collect one bobble of each colour (five when playing with 7 or 8 players).  The game starts with the coconuts mixed on the board so that no one knows which one contains which colour.  Then each player peeks at one coconut.  On your turn, you roll a die.  Results possible include turning the board 90 degrees, guessing at a coconut's bobbles' colour (that's how you get bobbles) and having eac...",2,8,20,20,20,7,Animals; Children's Game; Memory; Party Game,Set Collection,Animals: Apes / Monkeys; Series: Unser Lieblingsspiel (Georg Appl / Espenlaub),Hajo Bücken,Tom Espen; Bernhard Förth; IDL; Chris Mitchell (I); Michel Verdu,AS Company; Bookmark Verlag; Espenlaub; Gameplay Publishing ApS; Otto Maier Verlag; Ravensburger; Το Καλό Παιχνίδι Α.Ε.,26151,5.45412,5.48901,362,1.125,788
28238,Kitty Bitty,Kitty Bitty; Froggy Boogie; Kitty Cat; Re Re Kum Kum!; Toni Tümpel; 키티 비티,2007,"Whether published as Froggy Boogie or Kitty Bitty or some other name, the setting and gameplay of this design remain the same: It's nap time, but the baby critters just want to play. Your job is to make it happen, helping the critters move around without being seen by the adults. Players need to remember which adults are looking in which directions in order to avoid their stares and keep moving!&#10;&#10;",2,6,15,15,15,4,Animals; Children's Game; Memory,Dice Rolling; Memory,Animals: Cats; Animals: Frogs / Toads,Thierry Denoual,Gabriela Silveira; Stivo,Blue Orange Games; Zoch Verlag; Blue Orange (EU); Brainteasers; Egmont Polska; Lautapelit.fi; One Moment Games,20099,5.67645,5.51406,276,1.2222,466
284299,Box Monster,Box Monster; 박스몬스터,2021,"A silly monster lives in my house!&#10;Box monster eats everything in my room. A piece of pizza, my teddy bear and even grandma's false teeth! Then he has always stomach problem, of course. Help him to take out from his mouths the bad things he ate.&#10;&#10;Game Play&#10;&#10;&#10;     Put all stuff tokens in the box and shake it.&#10;     Shuffle the stuff cards and place the deck on the top of the box with hour glass and 3 life tokens.&#10;     reveal the top of the stuff card and check the s...",2,4,20,10,20,6,Action / Dexterity; Children's Game; Party Game,Cooperative Game; Set Collection,,Romain Caterdjian,Marie Cardouat,Mandoo Games; Granna; Lautapelit.fi; LOKI; MS Edizioni,21350,6.29275,5.50984,51,1,126
284435,Nova Luna,Nova Luna; Місяць-молодик; Новолуние; ノヴァルナ,2019,"The new moon is a symbol for a new beginning, the perfect time to start something new and to plan your future &mdash; and that is what Nova Luna (lat. for new moon) is all about. In each round of this abstract tile-laying game, you have to plan your future anew, developing a new strategy to cope with what the moon wheel has to offer you.&#10;&#10;On each turn, you have to decide which new tile from the moon wheel to place in front of you. Every new tile brings a new task you have to fulfill. In ...",1,4,60,30,60,8,Abstract Strategy; Puzzle,Contracts; Pattern Building; Race; Rondel; Tile Placement; Turn Order: Time Track,Digital Implementations: Board Game Arena; Digital Implementations: Tabletopia; Space: Earth's Moon; Theme: Art style – Art Nouveau,Uwe Rosenberg; Corné van Moorsel,Lukas Siegmon,Edition Spielwiese; Compaya.hu: Gamer Café Kft.; Djama Games; Funbox Editora; Games7Days; Hobby Japan; Lautapelit.fi; Lavka Games; Lucky Duck Games; Pegasus Spiele; SD Games; Stronghold Games; TLAMA games; White Goblin Games,617,7.26182,6.89068,9512,1.8713,13857
284593,Speedy Beedy,Speedy Beedy; Flitiga Biet,2019,"Buzz your bee across the meadow and grab the right flowers first! Turn a card to see what order the flowers have to be picked and be quick about it &ndash; because the fastest bee scores a point! A fun, action-filled matching game for young players. &#10;&#10;     Comes with durable plastic bees and flowers. &#10;     Easy-to-learn gameplay is suitable for very young players. &#10;     Look out for the bug that may try to ruin your game!&#10;&#10;&#10;&mdash;description from the publisher&#10;&#...",2,3,15,10,15,3,Animals; Children's Game; Real-time,,,(Uncredited),(Uncredited),Tactic,,5.75,0,10,1,16
28565,Save the Treasure of Fairy Tales,Save the Treasure of Fairy Tales; Fairy Tales; Olipa Kerran...; Red de sprookjesschat!; Rettet den Märchenschatz; Rettet den Märchenschatz!; Salvad el tesoro de cuentos!; Salvate il tesoro delle favole!; Salvem o tesouro dos contos!; Sauvez le Grand Livre des Contes!; Save the Fairy Tale Treasure!; Zaginiona Księga Baśni; 拯救童話,2006,"Story: An evil king has burned all fairy tale books. Only one is left, and its sheets have been shredded and scattered in an enchanted garden. Now the players must hurry and find the matching pieces, and leave the garden with them, before the king returns.&#10;&#10;Play: At any time, three book tiles are visible, the others are hidden below garden tiles. The player in turn may move up to two garden tiles (or rows of tiles). If there are two matching fairy tale pages visible after this move, he c...",2,4,30,20,30,5,Children's Game; Fantasy; Memory; Puzzle,Cooperative Game; Grid Movement; Memory; Modular Board; Set Collection,Series: Pegasus Children's Games (Matagot),Kai Haferkamp,Barbara Kinzebach; Anne Pätzke,"Egmont Polska; Lautapelit.fi; Pegasus Spiele; Selecta Spielzeug; Swan Panasia Co., Ltd.; Vennerød Forlag AS",16592,6.28715,5.52659,107,2,226
286422,Flip,Flip; 換言一新; 플립,2019,"FLIP is a communication &amp; storytelling game that help you to get to know others and learn their strengths and weaknesses. &#10;It is designed to experience personality theory through transactional analysis.&#10;&#10;You can play FLIP in three different ways.&#10;&#10;1. Players draft six weakness cards (five of which are their real weaknesses and a fake one), players pick three cards from their hands and tell stories about their weaknesses and others guess whether each stories are real or fa...",2,6,40,20,40,14,Bluffing; Educational,Role Playing; Storytelling; Voting,,Beagle Games; Mi-Sun Kim; Ji-Young Kim,Yeon Kim,Gemblo Company; 2Plus Games (灣加遊戲); BG Infinity,21933,7.44,5.50795,40,1,25
289231,Kimble Twist,Kimble Twist,2019,"Kimble Twist presents a new take on the children's game Trouble (known as Kimble in Northern Europe). The game features a new, game board with moving parts and a new Pop-o-Matic with two dice. The goal is still same as in the original game: being the first to move all your four pieces from START to FINISH.&#10;&#10;The difference to original comes from the special die, which can either make you twist the center of the board 1/4 of a round or turn a different part of the route half a round. This ...",2,4,60,20,60,6,Children's Game; Racing,Race; Roll / Spin and Move; Take That,,Richard Heayes,,Tactic; Belleville (Бельвіль),,5.33333,0,9,1,16
289359,iKnow junior,iKnow junior,2019,"Answer questions and perform different tasks, like simple drawing, reading and a lot, lot more! Contains 300 tasks and 100 picture questions along with clues.&#10;&#10;&mdash;description from the publisher&#10;&#10;",2,5,30,15,30,5,Card Game; Party Game; Trivia,Betting and Bluffing,Game: iKnow,,,Tactic; (Web published); Reflexshop,,4.25,0,14,1,38
290896,LOTTO,LOTTO; ลอตโต้; 泰想中樂透,2019,Each lottery master has different methods to get the prize number but getting the number aren't enough. They also need to find the Lotto with that number. Only the fastest one will get that Lotto. It doesn't matter how much Lottos you buy. The only thing that matters is what lottery number will be drawn.&#10;&quot; Hold on your cards and Win the lottery in LOTTO. &quot;&#10;&#10;Setup&#10;1. Each Player takes a set of Number cards with the same color.&#10;2. Randomly select 16 Lotto cards for th...,3,6,20,10,20,7,Bluffing; Card Game; Party Game,Betting and Bluffing; Events,,Thanakrit Kaewkhajorn,Aniu Rattanawadee Sukapad,"BGN; Swan Panasia Co., Ltd.",,6.35892,0,23,1.3333,45
