bgg_id,primary_name,all_names,year,description,min_players,max_players,playing_time,min_play_time,max_play_time,min_age,categories,mechanics,families,designers,artists,publishers,bgg_rank,average_rating,bayes_average,users_rated,weight,owned
19307,Barricade,Barricade; Road Block; Roadblock; Tactic; Trap Block,1974,"Barricade is played by two people.&#10;Each player has 5 playing pieces - 3 Scouts and 2 Guards.&#10;The objective is to reach your opponent's base stations on the board with your 3 Scouts, before he can reach yours. Proper use of your Guards and Scouts to block your opponent's Scouts may allow you to reach your objective first.&#10;&#10;Not to be confused with Barricade/Malefiz from 1960.&#10;&#10;",2,2,30,30,30,0,Abstract Strategy,,Players: Two-Player Only Games; Traditional Games: Halma,Sam S. Rakover,,BSiri Business; Marchant; Mitra; Oficina do Aprendiz; Orda Industries Ltd.,24426,5.46667,5.49848,39,1,180
193659,Super Math Spy,Super Math Spy; Matikka-agentti,2015,"Super Math Spy involves secret missions, decoder glasses, and lots of calculations.&#10;&#10;",2,4,0,0,0,7,Math,,,,,Chalk and Chuckles; Leikkien Group,,4.66667,0,3,0,2
193738,Great Western Trail,Great Western Trail; Great Western; Great Western Trail: Aventură prin Vestul Sălbatic; Great Western Trail: La Gran Ruta del Oeste; A nagy western utazás; Великий западный путь; グレート ウエスタン トレイル; 大西部之路; 大西鐵路; 그레이트 웨스턴 트레일,2016,"America in the 19th century: You are a rancher and repeatedly herd your cattle from Texas to Kansas City, where you send them off by train. This earns you money and victory points. Needless to say, each time you arrive in Kansas City, you want to have your most valuable cattle in tow. However, the &quot;Great Western Trail&quot; not only requires that you keep your herd in good shape, but also that you wisely use the various buildings along the trail. Also, it might be a good idea to hire capabl...",2,4,150,75,150,12,American West; Animals; Economic,"Deck, Bag, and Pool Building; Hand Management; Ownership; Set Collection; Track Movement; Variable Set-up","Animals: Cattle / Cows; Cities: Kansas City (Missouri, USA); Components: Control Boards; Components: Map (Regional scale); Components: Wooden pieces & boards; Country: USA; Digital Implementations: Board Game Arena; Game: Great Western Trail; Mechanism: Tableau Building; Series: The Great Designers (Stronghold Games); States: Texas",Alexander Pfister,Andreas Resch,eggertspiele; 999 Games; Arclight Games; Broadway Toys LTD; Conclave Editora; Delta Vision Publishing; Ediciones MasQueOca; Gigamic; Korea Boardgames; Lacerta; Ludicus Games; MINDOK; Pegasus Spiele; Plan B Games; Stronghold Games; uplay.it edizioni; YOKA Games; Zvezda,17,8.16577,7.99484,42692,3.6974,46265
19427,Gemblo,Gemblo; Gemblo Deluxe; Gemblo Light; Гембло; 寶石陣; 젬블로; 젬블로; 젬블로 딜럭스,2003,"Gemblo is an abstract strategy game with translucent, colored pieces, each of which is made up of one to five hexagons. Each player has an identical set of pieces in a unique color. The goal is to get rid of all of your pieces by placing them on the hexagonal game board. Each piece that you place after the first cannot touch previously-placed pieces of the same color; instead each piece must be a distance of &quot;1&quot; from another piece of the same color, where 1 is the length of a side of o...",2,6,30,30,30,6,Abstract Strategy,Grid Coverage; Hand Management; Hexagon Grid; Tile Placement,Category: Combinatorial; Components: Gems/Crystals; Containers: Hexagonal Boxes; Crowdfunding: Kickstarter; Game: Gemblo,Justin Oh,Justin Oh,"AURUM, Inc.; DG Games (I); Evrikus; Gemblo Company; Green Board Game Co.; Korea Boardgames; Schmidt Spiele; Swan Panasia Co., Ltd.; Wisemen Games",2968,6.78308,6.01475,1627,1.8571,1896
197831,Dark Souls: The Board Game,Dark Souls: The Board Game,2017,"The Dark Souls board game is a brutally hard exploration miniatures game for 1-4 players. Prepare to die.&#10;&#10;The game features a &quot;fast set-up, long reveal&quot; mechanism that gets you into the game quickly and builds the location as you explore. The sense of danger is palpable as you discover new locations and the monsters that inhabit these dark places. The core combat mechanism and enemy behavior system forces deep strategic play and clever management of stamina to survive.&#10;&#1...",1,4,120,90,120,14,Exploration; Fantasy; Fighting; Medieval; Miniatures; Video Game Theme,"Cooperative Game; Deck, Bag, and Pool Building; Dice Rolling; Grid Movement; Modular Board; Role Playing; Solo / Solitaire Game; Variable Player Powers",Category: Dungeon Crawler; Components: Miniatures; Crowdfunding: Kickstarter; Theme: Boss Battle; Video Game Theme: Dark Souls,David Carl; Alex Hall; Mat Hart; Richard Loxam,Thomas Lishman,Steamforged Games Ltd.; Ulisses Spiele,3523,6.43623,5.92781,4564,3.1429,9855
198454,When I Dream,When I Dream; Álmodj Velem!; Když sním; Kraina snów; Lumea Viselor; Όταν ονειρεύομαι; Країна Снів; Пока я сплю; בחלומותי; นักท่องฝัน; 私が夢みるとき; 說夢人; 꿈의 대화,2016,"The night has fallen and your mind is floating in the magical world of dreams. But the Dream Spirits want to have some fun tonight! They are giving their best and the dreams become strange and surreal. Become the dreamer, put on your sleeping mask and try to figure out your dream and which spirits are the Naughty ones. Become a good spirit and help the Dreamer by giving him clues about the dream before the naughty spirits mess it up. Close your eyes and dive in!&#10;&#10;At the beginning of each...",4,10,40,20,40,8,Deduction; Party Game; Real-time; Word Game,Communication Limits; Hidden Roles; Memory; Role Playing; Storytelling; Team-Based Game,Components: Blindfolds / Blackout Glasses; Components: Game Trayz Inside; Theme: Dreams / Nightmares; Word Games: Guess the Word,Chris Darsaklis,Jonathan Aucomte; Éric Azagury; Cyrille Bertin; Loïc Billiau; Sébastien Caiveau; Miguel Coimbra; Maëva da Silva; Julien Delval; Christine Deschamps; Vincent Dutrait; Nicolas Fructus; Anne Heidsieck; Gaël Lannurien; Fred Navez; Cyril Nouvel; Ismaël Pommaz; Christophe Swal; Régis Torres,Drawlab Entertainment; Repos Production; ADC Blackfire Entertainment; asmodee; Asterion Press; Galápagos Jogos; Gém Klub Kft.; GoKids 玩樂小子; Hobby Japan; Korea Boardgames; Lifestyle Boardgames Ltd; Playhouse; Rebel Sp. z o.o.; Siam Board Games; Sombreros Production; Ігромаг; פרש משחקים: Game Knight,1254,6.93233,6.50803,5987,1.191,10882
198740,Lovecraft Letter,Lovecraft Letter; ラブクラフト・レター; 洛夫克拉夫特的书信,2017,"It is the 1920s, and the world is in a state of confusion following WWI. During this time, you and your friends find yourselves amongst mysterious events. You are surrounded by strange figures, letters with unreadable texts, as well as sudden appearances of being unknown. By relying on your connections, you set out to investigate these incidents. Unknown to you are the frightful truths that lie in wait ahead of you...&#10;&#10;Lovecraft Letter is a card game that combines the Love Letter system ...",2,6,15,5,15,10,Card Game; Deduction; Fantasy; Horror,Deduction; Hand Management; Player Elimination; Score-and-Reset Game; Take That,Containers: Book-like; Game: Love Letter; Series: Big in Japan (AEG); Theme: Cthulhu Mythos,Seiji Kanai,Vincent Dutrait; Kouji Ogata,Alderac Entertainment Group; Switch Games; Arclight Games; Pegasus Spiele,914,7.22992,6.68215,5387,1.4455,9921
199478,Flamme Rouge,Flamme Rouge; Wielka Pętla; Крути педали,2016,"The excitement in the air is electric as the leaders round the last corner and head for the finish line. Each team has used cunning and skill to position their sprinter for this moment, but only one has done enough to pull off the win!&#10;&#10;Will your team lead from the front and risk exhaustion? Should you play it safe in the middle of the pack? Could you surprise everyone by striking from the back? Can you time your move perfectly?&#10;&#10;Anyone can race, few become champions!&#10;&#10;Fl...",2,4,45,30,45,8,Racing; Sports,Catch the Leader; Hand Management; Modular Board; Programmed Movement; Race; Simulation; Simultaneous Action Selection; Track Movement,Country: France; Game: Flamme Rouge; Misc: LongPack Games; Players: Games with expansions that add solo play; Sports: Bicycling / Cycling; Theme: Retro,Asger Harding Granerud,Ossi Hiekkala; Jere Kasanen,Lautapelit.fi; Conclave Editora; Devir; FoxGames; Gigamic; HOT Games; Lavka Games; MESAboardgames; Pegasus Spiele; Playagame Edizioni; Reflexshop; Stronghold Games,275,7.47902,7.22169,19109,1.698,24652
199793,Dokmus,Dokmus,2016,"Lead your tribe to glory on the island of Dokmus and become a legend!&#10;&#10;Dokmus is a board game for 2-4 players. Your goal is to lead an expedition to the island of Dokmus, the ancestral god of your tribe. The island is represented by eight double-sided map pieces. During set-up, you randomize which side of each map piece is up and place them in a 3x3 grid so that the middle place is left empty.&#10;&#10;The island is guarded by five Guardians, which are represented by Guardian cards. On e...",2,4,40,20,40,10,Abstract Strategy; Mythology; Territory Building,Area Majority / Influence; Grid Movement; Map Deformation; Open Drafting; Variable Player Powers,Components: 3 x 3 Grids; Islands: Fictional,Mikko Punakallio,Markku Laine; Sami Saramäki,Lautapelit.fi; Renegade Game Studios,2803,7.02709,6.05007,1283,2.0769,1846
199868,Slammy,Slammy,2014,"Slammy is a party game from Tactic. Every player has a hammer with suction cups, that can be used to pick up cards with. There will be a number of face-up cards on the board. Then turn one more card from the deck. Then all players should try to pick all the cards with the same symbol from the board with there hammer. After the deck of cards is gone, the player with most cards is the winner.&#10;&#10;Similar to: Hit the Hat&#10;&#10;",2,4,0,15,0,4,Children's Game; Party Game,,Theme: Clowns,,,Tactic,,3.5,0,5,0,2
199913,Honeycombs,Honeycombs,2016,"The object of honeycombs&trade; is to connect your tiles together by matching their symbols. The more matches you make the more points you earn.  The honeybee is wild and can be connected with any symbol. Honeycombs&trade; has three unique ways to play, each varying in speed and competitiveness.  Choose the one that suits your mood.&#10;  &#10;Version A &ndash; Worker Bee&#10;   Fast-paced competition between opponents&#10;   (2-4 players / 2-4 teams of 2)&#10;&#10;1. Divide tiles evenly among a...",1,8,30,15,30,6,Abstract Strategy; Children's Game; Puzzle,Cooperative Game; Hand Management; Tile Placement,Animals: Bees,Dave Clarke (IV),Holly Clarke; Dave Clarke (IV),4 Sisters Games; Lautapelit.fi; Piatnik,12740,6.1627,5.549,204,1.6,741
2001,Trivial Pursuit: Family Edition,Trivial Pursuit: Family Edition; Trivial Pursuit 2000 editie; Trivial Pursuit: Családi kiadás; Trivial Pursuit: Edição Família; Trivial Pursuit: Edição Familiar; Trivial Pursuit: Edicion Familia; Trivial Pursuit: édition famille; Trivial Pursuit: Edizione Famiglia; Trivial Pursuit: Edycja dla całej rodziny; Trivial Pursuit: Famiglia; Trivial Pursuit: Familie editie; Trivial Pursuit: Familien Edition; Trivial Pursuit: Familienedition; Trivial Pursuit: familjeupplaga; Trivial Pursuit: Familjeutgåva; Trivial Pursuit: Family Edition; Trivial Pursuit: Fjölskylduútgáfa; Trivial Pursuit: perhepainos; Trivial Pursuit: Семейное издание,1993,"Like Trivial Pursuit, but you have both senior and junior questions in different boxes, so the whole family can play it.&#10;&#10;",2,36,90,90,90,12,Children's Game; Party Game; Trivia,Roll / Spin and Move,Game: Trivial Pursuit; Series: Trivial Pursuit – Editions Régionales (France),(Uncredited),(Uncredited),Hasbro; Horn Abbot International; MB Juegos; Parker Brothers; Ruibal Hermanos S.A.,22542,5.58668,5.50594,1051,1.68,3195
20022,Terra Nova,Terra Nova,2006,"In Terra Nova, players try to claim areas of land by moving control markers and placing fences. Each turn, a player must take three actions, first moving a control marker, then taking two further actions from these possibilities: &#10;&#10;     moving a control marker (whether the same one or a different one) and/or&#10;     placing a fence next to a control marker that moved this turn.&#10;&#10;&#10;Areas are scored once they're enclosed and contain no more than three types of landscape. Whoeve...",2,4,45,45,45,10,Abstract Strategy; Territory Building,Area Majority / Influence; Enclosure; Grid Movement; Map Reduction,Category: Combinatorial; Series: Games Collection (Immortal Eyes),Gaetano Evola; Rosanna Leocata,Michael Menzel,Competo / Marektoy; Giochi Uniti; Immortal Eyes Games; Venice Connection; Winning Moves Germany,3570,6.44884,5.92136,1824,2.2577,2760
201808,Clank!: A Deck-Building Adventure,Clank!: A Deck-Building Adventure; Břink!: Velká podzemní loupež; Brzdęk!: Nie drażnij smoka; Clank!: Costruisci la tua Avventura; Clank!: Les Aventuriers du Deck-Building; Clank!: Um Deck Building de Aventura; Clank!: Una aventura de construcción de mazos; Klank!: Lopakodj és arass zajos sikert!; Klong!: Ein Deckbau-Abenteuer; Кланк! Подземное приключение; クランク!; 클랭크!: 덱 빌딩 어드벤처,2016,"Burgle your way to adventure in the deck-building board game Clank! Sneak into an angry dragon's mountain lair to steal precious artifacts. Delve deeper to find more valuable loot. Acquire cards for your deck and watch your thievish abilities grow. Be quick and be quiet. One false step and CLANK! Each careless sound draws the attention of the dragon, and each artifact stolen increases its rage. You can enjoy your plunder only if you make it out of the depths alive!&#10;&#10;Clank! is a deck-buil...",2,4,60,30,60,12,Adventure; Fantasy,"Action Points; Deck, Bag, and Pool Building; Delayed Purchase; End Game Bonuses; Movement Points; Open Drafting; Player Elimination; Point to Point Movement; Push Your Luck; Variable Set-up",Category: Dungeon Crawler; Creatures: Dragons; Creatures: Goblins; Creatures: Monsters; Digital Implementations: Dire Wolf Game Room; Digital Implementations: Steam; Game: Clank!; Misc: Mensa Select; Misc: Watch It Played How To Videos,Paul Dennen,Rayph Beisner; Raul Ramos; Nate Storm,Dire Wolf; Renegade Game Studios; Arclight Games; Conclave Editora; Devir; Korea Boardgames; Lavka Games; Lucrum Games; Raven Distribution; Reflexshop; REXhry; Schwerkraft-Verlag; Tabletop KZ,93,7.76717,7.60479,45396,2.2273,59550
20182,Maxi Yatzy,Maxi Yatzy; Super Yatzy,0,"Maxi Yatzy (or the &quot;Swedish Variation&quot; according to some) is Yahtzee with an extra die, more ways to score points and a feature where you can save extra rolls for later.&#10;&#10;The game is played like the classic dice game Yahtzee except you have 6 dice instead of 5. Each turn the player rolls up to three times trying to get as good a combination as possible and entering the score onto the scoreboard. Unlike regular Yahtzee the player can choose to forfeit one or two of the rolls in ...",1,6,30,30,30,6,Dice,Dice Rolling; Paper-and-Pencil; Push Your Luck; Set Collection,Digital Implementations: Board Game Arena; Traditional Dice Games: Yacht,(Uncredited),Bildgården AB; Per Sjöholm,Alga; Kärnan; N.W. Damm & Søn (Damm); Tactic,27362,5.32281,5.47628,210,1,336
20281,Inkan Aarre,Inkan Aarre; Inca's Treasure; Inkade Aarre; Inkas skatt; Золото инков :в поисках Эльдорадо,2005,"A new version of the most famous Finnish board game, Afrikan t&#195;&#164;hti. Designed by Kari Mannerla when 75 years old, the game is very similar to the original one from 1951, with a new map of South America instead of Africa, and seemingly better quality components. The &quot;bug&quot; in the original rules which allowed a player to get stuck on an island if robbed has been removed from this game.&#10;&#10;There is also a travel version which comes in a small plastic suitcase with magnetic ...",2,6,45,45,45,8,Exploration,Point to Point Movement; Roll / Spin and Move,Continents: South America,Kari Mannerla,Kari Häkkinen,Martinex; Peliko Oy; Нескучные игры,27761,4.89958,5.46701,118,1.0667,146
203780,Power Grid: The Card Game,Power Grid: The Card Game; Alta Tensión: El juego de cartas; Funkenschlag: Das Kartenspiel; Haute Tension: Le Jeu de Cartes; Hoogspanning: Het Kaartspel; Wysokie Napięcie: Gra karciana; Энергосеть. Карточная игра; 電力会社カードゲーム; 電力公司紙牌版,2016,"In Power Grid: The Card Game, the players represent CEOs of mighty power companies producing electricity.&#10;&#10;During the game, the players bid for power plants at auctions and supply them with resources. Their income depends on the amount of electricity produced in each round. At the end of the game, the player who produces the most electricity wins the game.&#10;&#10;Power Grid: The Card Game offers all the tension and tactics well-known of its two big brothers &mdash; Power Grid and Power...",2,6,60,45,60,12,Card Game; Economic; Industry / Manufacturing,Auction / Bidding; Market,Game: Power Grid; Versions & Editions: Card Versions of Non-Card Games,Friedemann Friese,Harald Lieske,"2F-Spiele; 999 Games; Arclight Games; Edge Entertainment; Hobby World; Lacerta; Lautapelit.fi; Rio Grande Games; Swan Panasia Co., Ltd.",2836,6.66065,6.04147,2047,2.3953,4835
204498,Match Madness,Match Madness; Crazy Cubes; Déblok; Puzzle Domino; Smart Domino; 매치 매드니스,2016,"Be the fastest to recreate with your blocks the pattern shown on a card to win the card. The player with the most cards at the end of the game is the winner.&#10;&#10;Each player receives a set of 5 blocks numbered 1 to 5. &#10;After shuffling the deck of pattern cards, players determine how many rounds they wish to play and take the same number of pattern cards from the top of the deck.  These cards are then placed, face down, in the center of the table.&#10;&#10;Game play:&#10;The top card fro...",1,4,20,10,20,7,Action / Dexterity; Deduction; Puzzle; Real-time,Pattern Recognition,,Jeppe Norsker,Karl Malepart,FoxMind; asmodee; Cranio Creations; FoxGames; Gemblo Company; HCM Kinzel; Leikkien Group; Reflexshop; SD Games,8461,6.2404,5.61073,476,1.0769,1153
204583,Kingdomino,Kingdomino; K-Domino'Z; Kingdomino XXL; Kingdomino: Expo 2020; Kingdomino: Ένα Ντόμινο για το Βασιλιά; Kingdomino. Доміношне Королівство; Доміношне Королівство; Кингдомино; Лоскутное Королевство; Поскутное Королевство; קינגדומינו; キングドミノ; 多米諾王國; 킹도미노,2016,"In Kingdomino, you are a lord seeking new lands in which to expand your kingdom. You must explore all the lands, including wheat fields, lakes, and mountains, in order to spot the best plots, while competing with other lords to acquire them first.&#10;&#10;The game uses tiles with two sections, similar to Dominoes. Each turn, each player will select a new domino to connect to their existing kingdom, making sure at least one of its sides connects to a matching terrain type already in play. The or...",2,4,25,15,25,8,Abstract Strategy; Medieval; Puzzle; Territory Building,Enclosure; Open Drafting; Tile Placement; Turn Order: Claim Action,Category: Dized Tutorial; Components: 5 x 5 Grids; Components: Non-Traditional Dominoes; Components: Scoring pad; Digital Implementations: Board Game Arena; Game: Kingdomino; Misc: LongPack Games; Misc: Watch It Played How To Videos; Series: Europe Collection (Blue Orange Games),Bruno Cathala,Cyril Bouquet; Pauline Detraz; Hervine Galliou,"Blue Orange (EU); Blue Orange Games; (Unknown); Buró; Coiledspring Games; Fantasmagoria; Feelindigo; FoxGames; FoxMind Israel; Games Factory Publishing; Gém Klub Kft.; Ghenos Games; Le Grand Massif; Happy Baobab; KADABRA; Kaissa Chess & Games; Lautapelit.fi; Lifestyle Boardgames Ltd; MEBO Games; MINDOK; MIPL; Oliphante; PaperGames (III); Pegasus Spiele; Pridemage Games; Swan Panasia Co., Ltd.; テンデイズゲームズ (TendaysGames); White Goblin Games",314,7.29593,7.17755,50740,1.2314,86664
204836,Escape Room: The Game,Escape Room: The Game; Escape Room: Das Spiel; Escape Room: il gioco; Escape Room: Jocul; Escape Room: Le Jeu; Escape Room: Pakohuonepeli; Escape Room: Spelet – Ut; Escape Room: Spillet; Escape Room: Úniková hra; אסקייפ רום: המשחק; 限時解鎖: 密室逃脫,2016,"Take the viral social experience of Escape Rooms to the comfort of your own home and for a fraction of the cost that you would pay! Included in this game are 4 unique 60 minute escape room puzzles that will test your cranial skills. Use images, gears, words, keys, shapes, maps and more to solve the three stages within each escape room. An analog timer on the Chrono Decoder centerpiece incessantly counts down, emitting ominous noises to create an environment shut out from the outside world. If th...",3,5,60,60,60,16,Electronic; Puzzle,Cooperative Game; Deduction; Elapsed Real Time Ending,Category: Escape Room Games; Misc: Limited Replayability; Series: Escape Room – The Game (Identity Games International B.V.),(Uncredited),Sebastian Goyke; Roland MacDonald,Identity Games International B.V.; ADC Blackfire Entertainment; Broadway Toys LTD; Concentra; Cranio Creations; Diset S. A.; FoxMind Israel; Galápagos Jogos; Maki A/S; Noris Spiele; Spin Master Ltd.; ToyRock Oy,1513,6.88584,6.40072,4339,2.2321,9689
205418,Agricola: Family Edition,Agricola: Family Edition; Agricola Editia de Familie; Agricola rodzinna; Agricola: Edición Familiar; Agricola: Edizione Famiglia; Agricola: Familie-Editie; Agricola: Familienspiel; Agricola: Familieudgave; Agricola: Familieutgave; Agricola: Famille; Agricola: Perheversio; Agricola: The Family Game; Agricola: Wersja rodzinna; アグリコラ：ファミリーバージョン; 農家樂：闔家歡樂版; 아그리콜라 패밀리,2016,"In Agricola, you're a farmer in a wooden shack with your spouse and little else. On a turn, you get to take only two actions, one for you and one for the spouse, from all the possibilities you'll find on a farm: collecting resources; building meadows; and so on. You might think about having kids in order to get more work accomplished, but first you need to expand your house. And what are you going to feed all the little rugrats?&#10;&#10;Agricola is a turn-based game. There are 14 game rounds oc...",1,4,45,45,45,8,Animals; Farming,Automatic Resource Growth; Worker Placement,Components: Meeples (Animal) / Animeeples; Game: Agricola; Occupation: Farmer; Series: Harvest (Uwe Rosenberg); Versions & Editions: Junior Versions of Grown-Up Games,Uwe Rosenberg,Klemens Franz,"Lookout Games; 999 Games; asmodee; Funforge; Hobby Japan; Korea Boardgames; Lacerta; Ludicus Games; Mayfair Games; Rebel Sp. z o.o.; Swan Panasia Co., Ltd.; uplay.it edizioni",1579,7.04337,6.37402,3187,2.3956,6688
206850,Muumipeikon kalaretki,Muumipeikon kalaretki,2016,"Moomintroll goes fishing. Players spread fish tiles on board face down and then take turns placing the Moomintroll figure on top of the tiles.&#10;&#10;If there's a fish, the tile is magnetic and will get stuck to the Moomintroll figure base. If the tile doesn't have fish, it won't catch.&#10;&#10;There are also Snufkin tiles that give you extra turns and Stinky tiles that make other players lose fish.&#10;&#10;The game ends when a player has managed to catch enough fish.&#10;&#10;",2,4,15,15,15,3,Children's Game; Comic Book / Strip,Memory,Characters: Moomins,Reiner Knizia,,Martinex; Peliko Oy,26643,4.8,5.48481,40,1,28
206940,Carcassonne: Amazonas,Carcassonne: Amazonas; Carcassonne: Amazone; Carcassonne: Rio delle Amazzoni; Каркасон: Амазонка; Каркассон: Амазонка,2016,"In Carcassonne: Amazonas, players sail their boats to the Amazon to discover abundant wildlife. Players score points not only for discovering animals, but also for visiting native villages and water courses while their boat moves forward on the Amazon. Amazon is full of caimans and piranhas which often (and somewhat unpredictably) bring points to those who are farthest down the river (you move your boats forward when you encounter boat symbols on your water courses and also when you do not place...",2,5,35,35,35,8,Animals; Exploration; Territory Building,Area Majority / Influence; Map Addition; Tile Placement; Track Movement,Country: Brazil; Digital Implementations: Tabletopia; Game: Carcassonne; Region: Amazon Rainforest; Series: Carcassonne Around the World,Klaus-Jürgen Wrede,Vicki Dalton,Hans im Glück; 999 Games; Devir; Fantasmagoria; Filosofia Éditions; Giochi Uniti; Hobby World; Lautapelit.fi; Piatnik; Z-Man Games,1956,7.026,6.24795,2256,1.8824,4930
