bgg_id,primary_name,all_names,year,description,min_players,max_players,playing_time,min_play_time,max_play_time,min_age,categories,mechanics,families,designers,artists,publishers,bgg_rank,average_rating,bayes_average,users_rated,weight,owned
401564,Ensimmäinen pelini: Sammakon loikka,Ensimmäinen pelini: Sammakon loikka; Fikaj i Hycaj,2023,"Hop across the lily pads! The small frogs must go home, but they must cross the pond on their way. Leap across lily pads and roll the die. The lily pads may reveal a surprise!&#10;&#10;The game features four cute wooden frogs and no plastic components. The die roll tells you what to do on your turn: hop to the next free lily pad, sit still for a turn, or flip over a lily pad, which may move you forward, backwards or help the frog in the last place.&#10;&#10;Ensimm&auml;inen pelini: Sammakon loik...",2,4,15,15,15,3,Children's Game,Roll / Spin and Move,Animals: Frogs / Toads,,Tea Söderlund,Tactic,,5,0,3,1,0
402697,Tangle Town,Tangle Town,2022,"An active and energetic game where you move the car with your finger to accomplish food delivery goals! Don&rsquo;t take your finger off the car, do not topple the clock tower or move the car from the board.  Gather as many points as possible to win the game!&#10;&#10;All players work for Tangle Dash, in a highly competitive work environment where the best courier is declared the employee of the month! To win, collect the most points by completing food orders, without toppling the City Hall cloc...",2,6,20,20,20,8,Action / Dexterity,Cooperative Game; Point to Point Movement,,,,Peliko Oy,,0,0,0,0,1
403354,Hedbanz Junior,Hedbanz Junior,2023,"Now younger players can play the goofy game where you never know what you are until you start asking questions! Players use clue cards to narrow down their choices: &quot;Do I have fur? Do I live in the jungle?&quot; First player to guess correctly wins!&#10;&#10;This version of Hedbanz Jr is all about animals. It also has a board and cards that help players keep track of what they guessed and what the answers were.&#10;&#10;Includes: 4 Headbands, 24 Animal Cards, 1 Animal Card Map, 32 Clue Card...",2,4,0,0,0,5,Animals; Children's Game,,Game: Hedbanz; Mechanism: Deduction – Blind Man's Bluff,,,Spin Master Ltd.,,2.5,0,2,0,21
405305,Opetellaan Sanaralli,Opetellaan Sanaralli,2023,Examine images and race to find words that start with different letters. Each word scores you a token on your bingo board. The first five-in-a-row wins! The game has two levels &ndash; younger players play with picture boards. The game supports learning to read. Special cards provide excitement! There's also a classification game to develop vocabulary and logical thinking skills.&#10;&#10;,2,4,15,10,15,4,Children's Game; Educational,Bingo,,,,Tactic,,0,0,0,0,0
405728,Star Wars,Star Wars,1984,"This licensed magnetic game is disguised as a cassette.&#10;&#10;It has 2 game modes:&#10;&#10;- game 1 (a new hope): 2 players. 7x4 lineal board with normal squares and explosions. The integrated roulette generates 1-6 results. The player who spins the highest number starts. Each player spins the roulette and advances the number of squares indicated in the result. When a player falls in an explosion marked square, the other player advances his victory bar 1 point. The first player who scores 10...",1,2,0,0,0,6,Children's Game; Movies / TV / Radio theme; Science Fiction,Modular Board; Roll / Spin and Move; Track Movement; Tug of War,Movies: Star Wars,,,Feber Juegos,,0,0,0,0,3
40628,Finca,Finca; Farmáři; Mallorca; Финка; フィンカ; 水果莊園,2009,"The gameboard of Finca shows the mediterranean island of Mallorca. Players try to crop and deliver the fruits of Mallorca (such as oranges, lemons, almonds, grapes etc.) by means of moving workers on a traditional windmill. Object of the game is to distribute your crop as effectively as possible in order to deliver faster than your opponents.&#10;&#10;From the Box: Mallorca, Island of the Wind. A place of golden beaches and a light-blue sea. The almond harvest is at hand, in addition, juicy oran...",2,5,45,45,45,10,Economic; Farming,Contracts; Mancala; Once-Per-Game Abilities; Rondel; Set Collection,Animals: Donkeys; Country: Spain; Digital Implementations: Board Game Arena; Digital Implementations: Yucata; Food & Drink: Fruit; Game: Finca; Islands: Mallorca (Spain); Occupation: Farmer,Wolfgang Sentker; Ralf zur Linde,Vincent Dutrait; Joan Guardiet; Franz Vohwinkel,"Hans im Glück; Pandasaurus Games; Albi; Arclight Games; Devir; Evrikus; Filosofia Éditions; franjos Spieleverlag; Ghenos Games; Giochi Uniti; Lautapelit.fi; Piatnik; Rio Grande Games; Swan Panasia Co., Ltd.",875,7.06839,6.70899,8044,2.0699,8198
406512,The Butterfly Collector,The Butterfly Collector,2023,"You wake up to the sound of a clock striking midnight. &#10;Its dark.&#10;Your head aches.&#10;All you remember from the night before is dancing in a nightclub with a beautiful tall dark haired stranger. &#10;You lean over and put on the lamp, look around and find yourself in a small locked room.&#10;The room only has a single bed, side table with a lamp, wall clock, backpack and notebook and pen lying on the floor besides the bed. &#10;The only way out of the room is through the door which has ...",1,1,30,15,30,14,Adventure; Card Game; Dice; Exploration; Horror; Print & Play,Dice Rolling,,Margaret-Rose Lester,,(Web published),,0,0,0,0,5
4077,Who Wants to Be a Millionaire,Who Wants to Be a Millionaire; 50 por 15; Chi vuol essere Milionario?; Haluatko miljonääriksi?; Hvem vil være millionær?; Legyen Ön is milliomos; Milionerzy; Die Millionenshow; Quem Quer Ser Milionário; Qui sera millionaire; Qui veut gagner des millions; ¿Quién quiere ser Millonario?; Quiz Millionaire; Vem vill bli miljonär; Vil du bli millionær?; Viltu vinna milljón?; Weekend Miljonairs; Wer wird Millionaer; Wer wird Millionär; Wer wird Millionär; Wer wird Millionär? (Dritte Edition); Wie wordt multimiljonair; Ποιος Θέλει να Γϊνει Εκατομμυριούχος?; Кто хочет стать Миллионером?,2000,"Players answer multiple-choice trivia questions of increasing difficulty, with the option of quitting with their winnings up to that point. This adaptation has makeshift versions of the TV show's &quot;50:50&quot;, &quot;Ask the Audience&quot;, and &quot;Phone a Friend&quot; lifelines. Players rotate as host, and after everyone has taken a turn as host, winnings are totaled.&#10;&#10;Based on the original ABC version of the world-famous game show, hosted by Regis Philbin from 1999-2002.&#10;&#10...",2,5,60,60,60,10,Movies / TV / Radio theme; Party Game; Trivia,Push Your Luck,TV Shows: TV Game Shows; TV Shows: Who Wants To Be A Millionaire,(Uncredited),,"(Unknown); Alga; Celador; danspil; Diset S. A.; Dujardin; Hasbro; Juguetes Ludik S.A.; Jumbo; Lansay; Mattel, Inc.; Piatnik; Pressman Toy Corp.; University Games",28709,4.59787,5.20827,1070,1.4177,2189
40834,Dominion: Intrigue,Dominion: Intrigue; Dominion: Die Intrige; Dominion: Hovin juonet; Dominion: Intriga; Dominion: Intrige; Dominion: Intrigo; Dominion: Intrika; Dominion: Intriky; Dominion: Intryga; Dominion: L'Intrigue; Доминион: Интрига; ドミニオン：陰謀; 皇輿爭霸之暗潮洶湧; 도미니언: 장막 뒤의 사람들,2009,"In Dominion: Intrigue (as with Dominion), each player starts with an identical, very small deck of cards. In the center of the table is a selection of other cards the players can &quot;buy&quot; as they can afford them. Through their selection of cards to buy, and how they play their hands as they draw them, the players construct their deck on the fly, striving for the most efficient path to the precious victory points by game end.&#10;&#10;From the back of the box: &quot;Something&rsquo;s afoot...",2,6,30,30,30,13,Card Game; Medieval,"Deck, Bag, and Pool Building; Delayed Purchase; Hand Management; Open Drafting; Variable Set-up",Crowdfunding: Wspieram; Digital Implementations: VASSAL; Game: Dominion,Donald X. Vaccarino,"Matthias Catrein; Julien Delval; Martin Hoffmann; Tomasz Jedruszek; Alexander Jung; Lars-Arne ""Maura"" Kalusky; Ryan Laukat; Harald Lieske; Dennis Lohausen; Michael Menzel; Marcel-André Casasola Merkle; Claus Stephan; Joshua J. Stewart; Christof Tisch; Franz Vohwinkel","Rio Grande Games; 999 Games; Albi; ASS Altenburger Spielkarten; Bard Centrum Gier; Devir; Filosofia Éditions; Games Factory Publishing; Gém Klub Kft.; Giochi Uniti; Hans im Glück; Hobby Japan; Hobby World; Korea Boardgames; Lautapelit.fi; Stupor Mundi; Swan Panasia Co., Ltd.; Vennerød Forlag AS",126,7.68853,7.50823,34296,2.4134,50463
40935,Zoowaboo,Zoowaboo; Tutajra fel!; Tutajra fel!; Vlotte Vrienden; Zoobaloo; Zvířátka na Palubu!; Zwierzaki na tratwie; 動物泛舟,2009,"Every year, the animals go on a rafting tour on the wild river, and nobody wants to miss out on the fun &mdash; but will there be enough room for all?&#10;&#10;At the start of each round in Zoowaboo, players lay out ten animal tokens around the one raft. One animal card is then drawn to represent the first animal that boards the raft. Each player has two chits &mdash; Yes and No &mdash; and they secretly vote on whether they think all animals revealed so far will fit on the raft. If all players ...",2,4,30,20,30,5,Action / Dexterity; Animals; Children's Game; Nautical; Real-time,Betting and Bluffing; Push Your Luck; Team-Based Game,Animals: Bears; Animals: Camels; Animals: Chickens / Roosters; Animals: Elephants; Animals: Foxes; Animals: Lions; Animals: Pigs; Animals: Rabbits / Hares; Animals: Sheep; Animals: Snakes; Series: Pegasus Children's Games (Matagot),Carlo A. Rossi,Anne Pätzke; Gabriela Silveira,Compaya.hu: Gamer Café Kft.; Competo / Marektoy; Egmont Polska; Lautapelit.fi; Matagot; MINDOK; Pegasus Spiele; Rio Grande Games; Selecta Spielzeug; TWOPLUS Games; Vennerød Forlag AS; Zhiyanjia,7510,6.31787,5.63708,480,1.0513,797
40993,Animals of the World,Animals of the World; Le Grand quiz des Animaux; Maailman Eläimet tietovisa; Verdens dyr; Vilda djur på vår planet; Všechna zvířata světa; Wild Animals; Wild animals of the world quiz; Zvířata světa; Дикие животные мира; Тварини світу,2009,"A fun, educational game about animals for the whole family! The game contains 200 cards filled with interesting questions and facts about 200 different species all over the world. Play the easier version where you recognize the animals and answer questions about them &ndash; or try the more challenging version and see if you know the animal&rsquo;s range, conservation status and Latin name as well!&#10;&#10;",2,8,15,15,15,7,Animals; Trivia,,,(Uncredited),(Uncredited); Michal Peichl,Albi; Belleville (Бельвіль); Tactic,,5.04167,0,12,0,50
41010,My First Carcassonne,My First Carcassonne; Carcassonne Gyermekei; Carcassonne Junior; Děti z Carcassonne; Dzieci z Carcassonne; The Kids of Carcassonne; Die Kinder von Carcassonne; Lasten Carcassonne; Mon premier Carcassonne; Дети Каркассона; Каркасон для дітей; Каркассон Junior; 卡卡頌兒童版,2009,"Story: On 14 July, the national holiday in France, the sheep, chickens and cows are set free in the town of Carcassonne. The children have great fun to catch the animals before dusk.&#10;&#10;In Carcassonne Junior, a.k.a. My First Carcassonne, the players in turn draw a landscape tile and place it; unlike in normal Carcassonne, they always match. Amongst other features, the tiles show children in the player colors on the roads. Whenever a road is finished, every player places one of their meeple...",2,4,20,10,20,4,Children's Game; Medieval,Enclosure; Modular Board; Tile Placement,Cities: Carcassonne (France); Game: Carcassonne; Versions & Editions: Junior Versions of Grown-Up Games,Marco Teubner,Marcel Gröber; Rolf Vogt,"Hans im Glück; 999 Games; Bard Centrum Gier; Brain Games; Devir; Enigma (Bergsala Enigma); Feelindigo; Filosofia Éditions; Giochi Uniti; Hobby World; Lautapelit.fi; MINDOK; Oxygame; Piatnik; Rio Grande Games; Schmidt Spiele; Smart Ltd; Swan Panasia Co., Ltd.; Z-Man Games",2033,6.6538,6.22835,4635,1.1303,9808
410167,Crime Scene: Tokyo 2000,Crime Scene: Tokyo 2000,2023,"Enter the Crime Scene&hellip; A frighteningly ordinary crime brings detectives to the financial center of Tokyo, but everything is not what it seems. Here, true power resides in the shadows.&#10;&#10;Once you start your investigation, your life&rsquo;s on the line.&#10;Can you bring the truth to light before it&rsquo;s too late?&#10;&#10;",1,4,120,120,120,18,Card Game; Deduction; Murder / Mystery; Puzzle,Cooperative Game; Deduction,Cities: Tokyo (Japan); Series: Crime Scene (Tactic),,,Tactic,,6.5,0,1,0,10
410201,Wyrmspan,Wyrmspan; Na křídlech draků; Na skrzydłach smoków; Reptáv; Schwingenschlag; Змієвир; ワイアームスパン; 龍翼翱翔; 용스팬,2024,"You are an amateur dracologist in the world of Wyrmspan, a place where dragons of all shapes, sizes, and colors roam the skies. Excavate a hidden labyrinth you recently unearthed on your land and entice these beautiful creatures to roost in the sanctuary of your caves.&#10;&#10;During a game of Wyrmspan, you will build a sanctuary for dragons of all shapes and sizes. Your sanctuary begins with 3 excavated spaces&mdash;the leftmost space in your Crimson Cavern, your Golden Grotto, and your Amethy...",1,5,90,90,90,14,Animals; Card Game; Fantasy,End Game Bonuses; Hand Management; Once-Per-Game Abilities; Open Drafting; Solo / Solitaire Game; Track Movement; Turn Order: Progressive,Category: Dized Tutorial; Creatures: Dragons; Digital Implementations: Tabletopia; Game: Wingspan; Mechanism: Tableau Building; Misc: Made by Panda; Organizations: Automa Factory; Players: Games with Solitaire Rules,Connie Vogelmann,Clémentine Campardou,Stonemaier Games; 999 Games; Arclight Games; Automa Factory; Delta Vision Publishing; Divercentro; Feuerland Spiele; Ghenos Games; Grok Games; Korea Boardgames; Maldito Games; Matagot; MINDOK; NeoTroy Games; Rebel Sp. z o.o.; Regatul Jocurilor; Siam Board Games; Surfin' Meeple China; Ігромаг,138,7.99583,7.48291,11483,2.8075,25226
410220,Top It,Top It,2023,"In this edge-of-your-seat party game you race to place your cones on letter discs whilst calling out examples to teasing topics. But beware, any other player can Top It with another answer and place their cone on top of yours! Only the last cone counts and bags all the points!&#10;&#10;",2,6,60,20,60,10,Real-time; Word Game,Real-Time,Misc: LongPack Games; Word Games: First Letter Given,,,AMO Toys; Cheatwell Games,,4.83333,0,6,1,7
4143,Guess Who?,"Guess Who?; ¿Quién es quién?; ¿Quién es quién? Star Wars; ¿Quien soy yo?; Adivina Quien?; Adivinha Quem?; Arvaa kuka?; Bil Bakalım Kim?; Caccia Al Colpevole?; Cara a Cara?; Cara a Cara? Marvel Heroes; Cara a Cara? Princesas Disney; Cual es Cual?; Descobre Quem Sou?; Gettu hver?; Gissa vem?; Gjett hvem?; Guess Who? Cars 2; Guess Who? Disney Edition; Guess Who? Disney Jr; Guess Who? Disney Princess; Guess Who? Fun on the Run; Guess Who? Giant Edition; Guess Who? Grab&Go; Guess Who? Littlest Pet Shop Edition; Guess Who? Marvel Heroes Edition; Guess Who? Star Wars Edition; Guess Who? Wizarding World: Harry Potter; Guess Who?: Animal Crossing New Horizons; Guess Who?: English Heritage; Guess Who?: Mythical Edition; Guess Who?: Super Mario; Hádej, kdo je to?; Hvem er hvem?; Identitet Okänd?!; Indovina chi?; Indovina Chi? Juventus; Kabouter Plop de Zoekkampioen; Mijn eerste Wie Is Het?; Pokémon Diamond and Pearl: Guess That Pokémon; Power Rangers Samurai: Guessing Game; Profiler; Qui est-ce?; Qui est-ce? Disney Pixar; Qui est-ce? Olympique Lyonnais; Qui Est-ce?: Équipe de France – FFF; Qui suis-je: Who Am I; Qui suis-je?; Quien Puedo Ser?; Quién se esconde?; Der Sohn des Asterix: Wer ist es?; SpongeBob Erinnere Dich?; Thomas & Friends Guessing Game; Travel Guess Who?; Vem där?; Wer Bin Ich?; Wer ist es?; Wer war's?; Which Hero is it?; Who Am I?; Who Is It?; Who's who?; Who's Your Friend?; Whoosit?; Wie is 't?; Wie is het?; Zagadkowe ZOO; Zgadnij kto to?; Μάντεψε Ποιος?; Μάντεψε ποιός?: Disney edition; Угадай кто?; נחש מי; 猜猜我是誰？; 누구일까요?",1979,"The mystery face game where you flip over a collection of faces with different color hair, eye color, hair, hats, glasses etc.  to deduce who the secret person is that your opponent has chosen. You flip over the hooked tiles as you narrow your choices by asking characteristic questions.&#10;&#10;",2,2,20,20,20,6,Children's Game; Deduction; Movies / TV / Radio theme,Deduction; Questions and Answers,Animals: Fish / Fishes; Books: Harry Potter; Brands: Disney; Comic Books: Asterix; Comic Books: Marvel Universe; Components: Magnets; Food & Drink: Chocolate; Game: Guess Who?; Mechanism: Deduction – Blind Man's Bluff; Misc: Dice Tower Hall of Fame; Movies: Cars; Movies: Finding Nemo; Movies: Pixar; Movies: Star Wars; Players: Two-Player Only Games; Series: Giant Edition (Spin Master); Series: Nostalgia (Hasbro); Sports Teams: Olympique Lyonnais; Theme: Superheroes; Toys: Littlest Pet Shop; TV Shows: Power Rangers; TV Shows: SpongeBob SquarePants; TV Shows: Thomas the Tank Engine; TV Shows: Warner Bros.; Video Game Theme: Nintendo; Video Game Theme: Pokémon; Video Game Theme: Super Mario Bros.,Theo Coster; Ora Coster; Theora Design,(Uncredited); Hasbro Studios; Theora Design,(Unknown); Cartamundi; Chad Valley Co Ltd.; Crown Games; Editions ATLAS; Estrela; Falomir Juegos; Funville Games; Gamesformotion; Global Toys AB; Hasbro; IMC Toys; Just Play; Korea Boardgames; Lakeside; MB Giochi; MB Jeux; MB Juegos; MB peli; MB Spellen; MB Spiele; Milton Bradley; Müller Ltd. & Co. KG; Nilco S.A.; Paul Lamond Games Ltd; Pavilion; Popular de Juguetes; Pressman Toy Corp.; Simba Toys; Spin Master Ltd.; Studio100; Teorema; Tomland; Top-Game; Toy Place; Trixy Games; Winning Moves France; Winning Moves Games (USA); Winning Moves UK Ltd.,28743,4.84678,4.9485,6988,1.0931,13114
41916,The Magic Labyrinth,The Magic Labyrinth; Az elvarázsolt labirintus; El Laberint Màgic; El Laberinto Mágico; Il Labirinto Magico; O Labirinto Mágico; Labirintul Magic; Le Labyrinthe magique; Il Labyrinto Magico; Maaginen labyrintti; Magi Labyrinten; Magi-Labyrinten; Magic Labyrinth; Magický labyrint; Magiczny Labirynt; Magilabyrinten; Het Magische Labyrint; Das Magische Labyrinth; Den magiska labyrinten; Den magiske labyrint; Ο Μαγικός Λαβύρινθος; Магический лабиринт; Магічний лабіринт; קסם המבוך; 磁石魔法迷宮; 마법의 미로,2009,"The little magician apprentices have lost some magic objects inside of the master&rsquo;s maze. Now they try to collect them before the Master notices anything. However, in the maze there are invisible walls and only one of the missing objects is revealed at a time. So they have to make their way through the maze by means of a good memory and lots of skill.&#10;&#10;Each player moves their magician over the board while trying not to bump the labyrinth below. Each magician is joined with a magnet...",2,4,30,20,30,6,Children's Game; Fantasy; Maze; Memory,Dice Rolling; Grid Movement; Memory; Network and Route Building; Roll / Spin and Move,Components: Game Box Used In Play; Components: Magnets; Components: Wooden pieces & boards,Dirk Baumann,Rolf Vogt,"Drei Magier Spiele; ADC Blackfire Entertainment; Competo / Marektoy; Devir; Enigma (Bergsala Enigma); G3; Gigamic; HaKubia; Kaissa Chess & Games; Korea Boardgames; Lautapelit.fi; Lion Rampant Imports; Oxygame; Playgo Hungary; Playroom Entertainment; Spilbræt.dk; Swan Panasia Co., Ltd.; Vennerød Forlag AS; YellowBOX; Ґавіал; Нескучные игры",1429,6.81332,6.4332,6488,1.21,12474
421084,5 Up,5 Up,2024,"UNIQUE DICE GAME: Up the stakes at your next game night with 5 Up from TOMY Games. Victory is just a dice throw away in this risky 2 to 4 player game that has players race to get rid of all their tokens by landing the dice on the coveted 5 Up side.&#10;&#10;PUSH YOUR LUCK: Unzip and unfold the pouch to reveal the game mat. Each player starts with 10 tokens. Roll the dice and whatever number you get, place a token on the corresponding number on the mat. If you roll a 5 Up, you get to discard a to...",2,4,30,5,30,0,Dice,Dice Rolling; Push Your Luck,,,,Tomy; Peliko Oy,,6.6,0,10,1,30
424619,Crime Scene: Vienna 1824,Crime Scene: Vienna 1824; Crime Scene: Wien 1824,2024,"May 7, 1824, Vienna, Austria&#10;&#10;The premiere of Beethoven&rsquo;s ninth symphony becomes a stage of death. You are a hardened chief of police who has seen better days. Can you solve the most bitter case of your career?&#10;&#10;Everyone in the crowd becomes a suspect in a double murder. Can you unravel the deadly plot?&#10;&#10;&mdash;description from the publisher&#10;&#10;",1,4,120,120,120,18,Card Game; Deduction; Murder / Mystery; Puzzle,Cooperative Game; Deduction; Finale Ending,Series: Crime Scene (Tactic),Richard Heayes; Markku Heljakka; Petter Ilander,Ville Koivula,Tactic; Piatnik,,4.92,0,5,0,17
429269,Fishing Game,Fishing Game,0,"The magnet fishing Game is a fun and educational way to learn and play.&#10;&#10;Each fish displays a different number, after fishing all the wooden toys block pieces, add the scores together and count to see who wins!&#10;&#10;It includes 26 wooden fish puzzles, which are patterned with the alphabet, numbers, and cute ocean creatures.&#10;&#10;",2,2,0,0,0,3,Children's Game; Math,,Components: Magnets,,,TopBright Toys (TOP BRIGHT),,6,0,1,0,7
430160,SMASK!,SMASK!,2024,"SMASK! is a fast-paced game where players compete on who grabs the correct apple slice the fastest. Players throw the Dice Worm to indicate which slice they must catch. The player who grabs the correct slice gets a point. If the slice indicated by the Dice Worm is already taken by a player, the fastest to shout the name of the player, gets the slice for themselves! Smask! is a fast-paced game requires quick reflexes, pattern recognition, and attentiveness.&#10;&#10;",2,6,20,15,20,5,Action / Dexterity; Children's Game; Real-time,Dice Rolling; Pattern Recognition; Real-Time,Animals: Worms,Gil Druckman; Danny Hershkovits,,Martinex; Peliko Oy,,0,0,0,0,1
431152,Opetellaan Liikennepeli,Opetellaan Liikennepeli,2024,"Opetellaan Liikennepeli is an educational board game for children aged 6&ndash;10 that teaches them traffic rules and regulations. Players must visit specific points on the board. Each turn begins with a traffic trivia question, and correct answers will give more movement points.&#10;&#10;",2,4,30,15,30,6,Children's Game; Educational,Action Points; Movement Points; Point to Point Movement; Race,Theme: Traffic / Driving,,,Tactic,,5.33333,0,3,2,0
432,Take 5,Take 5; !شیش قلو; ¡Toma 6!; 6 bere!; 6 ima!; 6 neemt!; 6 nimmt!; 6 nimmt! Jubiläumsausgabe; 6 nimmt! Jubiläumsedition; 6 qui prend!; 6 takes; 6 Tar; 6 Võtab; 6 бepёt!; 6. bierze!; 6. Ņem!; 6. nem!; 6. nosi!; 6...le prendi!; 6...pega!; 6...prendi e perdi; Beat the Heat; Category 5; Ota 6!; Păzea de 6!; Pega em 6!; Sei; Ta 6!; Tag 6!; Take 5!; Take 5!; Take 6; Take 6!; Tjurskalle; Toma 6!; Vigyáz(z)6!; Πάρε 5!; Ταυράκια; Корова 006; Корова 006 Делюкс; שישי לוקח; อุ๊ยตาย ควายหก; ニムト; 牛頭王; 誰是牛頭王？; 젝스 님트!,1994,"In 6 nimmt!, a.k.a. Category 5 and many other names, you want to score as few points as possible.&#10;&#10;To play the game, you shuffle the 104 number cards, lay out four cards face-up to start the four rows, then deal ten cards to each player. Each turn, players simultaneously choose and reveal a card from their hand, then add the cards to the rows, with cards being placed in ascending order based on their number; specifically, each card is placed in the row that ends with the highest number t...",2,10,45,45,45,8,Card Game; Number; Party Game,Hand Management; Score-and-Reset Game; Simultaneous Action Selection,Animals: Cattle / Cows; Containers: Tin/Metal Box; Digital Implementations: Board Game Arena; Digital Implementations: BrettspielWelt; Game: 6 nimmt!; Misc: Dice Tower Hall of Fame; Misc: LongPack Games; Misc: Lowest Score Wins; Misc: Mensa Select,Wolfgang Kramer,Timur Baskakov; Design Edge; Oliver Freudenreich; Bill Herrin; Gatis Sluka; Franz Vohwinkel,"AMIGO; 999 Games; Albi; asmodee; Brain Games; Broadway Toys LTD; Bureau de Juegos; Buró; Carletto; Copag Cards; Dal Negro; Dr. Wood Challenge Centre; Endless Games (I); Fractal Juegos; G3; Gigamic; Giochi Uniti; Hasbro; Kaissa Chess & Games; Kärnan; Kikigagne?; Korea Boardgames; Land of Beautiful Mind (سرزمین ذهن زیبا); Lanlalen; Last Level; Lautapelit.fi; Lifestyle Boardgames Ltd; Mar Lúdico; Max Bersinger; Mayfair Games; Mercurio; Midgaard Games; MIPL; Möbius Games; Nelospelit; Pando Games; Paper Iyagi; Piatnik; Rebel Sp. z o.o.; Shafir Games (המשחקים של חיים שפיר); Swan Panasia Co., Ltd.; Tempo Games (I); U.S. Games Systems, Inc.; VR Distribution",673,6.97846,6.85182,31196,1.1912,47167
